id,created_at,text,rt_count,fav_count,english
1208617336665542656,2019-12-22 05:16:42+00:00,"Today I visited the Picton community in NSW to offer my support to some of the families who’ve lost everything in these terrible bushfires. It’s days like these when you see the best of Australia - friendship, neighbours looking after each other, simple kindnesses being extended. https://t.co/4rngBvHmOw",160,1378,"Today I visited the Picton community in NSW to offer my support to some of the families who’ve lost everything in these terrible bushfires. It’s days like these when you see the best of Australia - friendship, neighbours looking after each other, simple kindnesses being extended. https://t.co/4rngBvHmOw "
1206344759112945664,2019-12-15 22:46:18+00:00,"Today marks a week since the tragedy on Whakaari/White Island in NZ, which so far has claimed 19 lives, including 10 Australians, and left many others with horrific injuries.",63,396,"Today marks a week since the tragedy on Whakaari/White Island in NZ, which so far has claimed 19 lives, including 10 Australians, and left many others with horrific injuries. "
1205360926691512320,2019-12-13 05:36:54+00:00,Congratulations @BorisJohnson on a resounding victory and being returned as UK PM. Looking forward to the stability this brings and a new deal for Oz with the UK. Say g’day to the quiet Britons for us. https://t.co/1SDQPIhNFZ,1610,8654,Congratulations @BorisJohnson on a resounding victory and being returned as UK PM. Looking forward to the stability this brings and a new deal for Oz with the UK. Say g’day to the quiet Britons for us. https://t.co/1SDQPIhNFZ 
1204866282220187649,2019-12-11 20:51:21+00:00,"#BREAKING: Aerial firefighting efforts will get another $11m boost from the Federal Government today, to help combat these terrible #bushfires. This is on top of the $15 million already provided each year. https://t.co/9m4IS4EWqd",266,1334,"#BREAKING: Aerial firefighting efforts will get another $11m boost from the Federal Government today, to help combat these terrible #bushfires. This is on top of the $15 million already provided each year. https://t.co/9m4IS4EWqd "
1204659882395201536,2019-12-11 07:11:12+00:00,Our hearts go out to those caught up in the Whakaari/White Island volcano tragedy. Today we activated a repatriation plan to bring a number of the Australians injured home for specialist medical care ⬇️ https://t.co/FJbEmM5kTT,55,419,Our hearts go out to those caught up in the Whakaari/White Island volcano tragedy. Today we activated a repatriation plan to bring a number of the Australians injured home for specialist medical care ⬇️ https://t.co/FJbEmM5kTT 
1204016097034305536,2019-12-09 12:33:01+00:00,The latest on the volcano eruption on Whakaari/White Island in NZ ⬇ https://t.co/umcHb56ubW,74,290,The latest on the volcano eruption on Whakaari/White Island in NZ ⬇ https://t.co/umcHb56ubW 
1203932820961284096,2019-12-09 07:02:07+00:00,A terrible tragedy is unfolding in NZ after the volcano eruption on Whakaari/White Island. Australians have been caught up in this terrible event and we are working to determine their wellbeing.,156,744,A terrible tragedy is unfolding in NZ after the volcano eruption on Whakaari/White Island. Australians have been caught up in this terrible event and we are working to determine their wellbeing. 
1203557210791395329,2019-12-08 06:09:34+00:00,Our firefighters battling the bushfires are truly amazing. Today I visited the @NSWRFS in Wilberforce to say thanks for everything they’re doing and to get the latest update from @RFSCommissioner Shane Fitzsimmons on the fires. https://t.co/LOwehDSmMH,101,717,Our firefighters battling the bushfires are truly amazing. Today I visited the @NSWRFS in Wilberforce to say thanks for everything they’re doing and to get the latest update from @RFSCommissioner Shane Fitzsimmons on the fires. https://t.co/LOwehDSmMH 
1202473231208173568,2019-12-05 06:22:13+00:00,"Today on International Volunteer Day, we say a heartfelt thank you to all the amazing volunteers who help make Australia the best place in the world to live. https://t.co/02J0zUbRxb",123,924,"Today on International Volunteer Day, we say a heartfelt thank you to all the amazing volunteers who help make Australia the best place in the world to live. https://t.co/02J0zUbRxb "
1202395489037103104,2019-12-05 01:13:18+00:00,"We're putting the needs of Australians at the centre of Government, ensuring access to simple &amp; reliable services. That’s why I've announced major changes to the Public Service today, including reducing the number of government departments from 18 to 14. https://t.co/irWtWnd2VN",67,437,"We're putting the needs of Australians at the centre of Government, ensuring access to simple &amp; reliable services. That’s why I've announced major changes to the Public Service today, including reducing the number of government departments from 18 to 14. https://t.co/irWtWnd2VN "
1202326201882169344,2019-12-04 20:37:59+00:00,Great to meet these Enterprising Girls yesterday and hear their innovative ideas and pitches. We’re funding the Academy of Enterprising Girls to support and bolster their entrepreneurial spirit. https://t.co/tYdwOvPikM https://t.co/BE0PTegApt,27,169,Great to meet these Enterprising Girls yesterday and hear their innovative ideas and pitches. We’re funding the Academy of Enterprising Girls to support and bolster their entrepreneurial spirit. https://t.co/tYdwOvPikM https://t.co/BE0PTegApt 
1201720254633693185,2019-12-03 04:30:10+00:00,"1 in 5 Australians live with a disability. They're true champions &amp; make a huge contribution to our country. It's International Day of People with Disability, which is about increasing understanding &amp; acceptance of people with disability &amp; celebrating their achievements. #IDPWD https://t.co/MCyz7wmd71",157,788,"1 in 5 Australians live with a disability. They're true champions &amp; make a huge contribution to our country. It's International Day of People with Disability, which is about increasing understanding &amp; acceptance of people with disability &amp; celebrating their achievements. #IDPWD https://t.co/MCyz7wmd71 "
1201411728904339456,2019-12-02 08:04:11+00:00,"30 people are rescued by our surf lifesaving movement in Australia, every day. Today I launched the Surf Life Saving Summer Season at Parliament, where we recognised the dedication of those amazing volunteers who put their lives on the line every day to keep us safe in the water. https://t.co/wLDXULdps1",48,414,"30 people are rescued by our surf lifesaving movement in Australia, every day. Today I launched the Surf Life Saving Summer Season at Parliament, where we recognised the dedication of those amazing volunteers who put their lives on the line every day to keep us safe in the water. https://t.co/wLDXULdps1 "
1200529823128375297,2019-11-29 21:39:49+00:00,"Just terrible news out of London &amp; The Hague. Whether it has been the  despicable acts of terrorists in the UK, or as yet not determined in the Netherlands, Australians’ deepest sympathies are with the victims &amp; their families - they were innocent people going about their lives.",126,758,"Just terrible news out of London &amp; The Hague. Whether it has been the  despicable acts of terrorists in the UK, or as yet not determined in the Netherlands, Australians’ deepest sympathies are with the victims &amp; their families - they were innocent people going about their lives. "
1199879616250310656,2019-11-28 02:36:07+00:00,"Australians are saddened by the passing of Clive James. He was a great novelist, poet, wit and personality who showcased the good humour and good nature of Australians. Clive had a deep love for our country, and expressed that deep affection in all that he said and did.",71,656,"Australians are saddened by the passing of Clive James. He was a great novelist, poet, wit and personality who showcased the good humour and good nature of Australians. Clive had a deep love for our country, and expressed that deep affection in all that he said and did. "
1199524080052924416,2019-11-27 03:03:21+00:00,"Continuing to expand opportunities for our exporters is key to our plan to strengthen our economy. Since elected, we’ve increased our two-way trade covered by free trade agreements from 26% to over 70%. That’s helped create more jobs &amp; increased investment in Australia. https://t.co/J0KiJLMQb8",40,266,"Continuing to expand opportunities for our exporters is key to our plan to strengthen our economy. Since elected, we’ve increased our two-way trade covered by free trade agreements from 26% to over 70%. That’s helped create more jobs &amp; increased investment in Australia. https://t.co/J0KiJLMQb8 "
1199476011202535424,2019-11-26 23:52:20+00:00,"The Country to Canberra initiative is amazing, opening doors and opportunities to young rural women. Thanks for coming to visit yesterday. https://t.co/vG1jl7O2lQ",34,235,"The Country to Canberra initiative is amazing, opening doors and opportunities to young rural women. Thanks for coming to visit yesterday. https://t.co/vG1jl7O2lQ "
1198391512163184640,2019-11-24 00:02:56+00:00,"The Clontarf Foundation changes the lives of young indigenous men and boys, helping them to stay in school, get a job and be hopeful for their future. Was great to catch up with the boys, and hear their stories, as we trekked the Six Foot Track, west of Sydney, together. https://t.co/krWd6jcFLA",67,399,"The Clontarf Foundation changes the lives of young indigenous men and boys, helping them to stay in school, get a job and be hopeful for their future. Was great to catch up with the boys, and hear their stories, as we trekked the Six Foot Track, west of Sydney, together. https://t.co/krWd6jcFLA "
1198347339112448001,2019-11-23 21:07:24+00:00,The Clontarf Foundation are changing young men's lives all across Australia. Thanks for allowing me to spend time with you guys. https://t.co/PjBSqkxwyi,16,147,The Clontarf Foundation are changing young men's lives all across Australia. Thanks for allowing me to spend time with you guys. https://t.co/PjBSqkxwyi 
1198346581507891201,2019-11-23 21:04:23+00:00,Have been supporting the Clontarf Foundation for around a decade. A truly inspirational and practical programme getting awesome results. Thanks for allowing me to spend time with you guys. https://t.co/w6qu74PBfs,47,338,Have been supporting the Clontarf Foundation for around a decade. A truly inspirational and practical programme getting awesome results. Thanks for allowing me to spend time with you guys. https://t.co/w6qu74PBfs 
1197632524379230208,2019-11-21 21:46:59+00:00,"We’re investing in bringing forward the construction of major road projects in Victoria, like the Monash Freeway &amp; North East Link, to drive jobs &amp; the economy and get people home sooner &amp; safer. https://t.co/8PZ6ns6I4e",41,249,"We’re investing in bringing forward the construction of major road projects in Victoria, like the Monash Freeway &amp; North East Link, to drive jobs &amp; the economy and get people home sooner &amp; safer. https://t.co/8PZ6ns6I4e "
1197390819579199488,2019-11-21 05:46:32+00:00,"Two more breakthrough new treatments for Australians living with lung cancer &amp; leukaemia will be listed on the PBS from 1 Dec. Since 2013, we’ve made over 2200 new or amended listings on the PBS. That’s around 1 a day, saving &amp; changing Australians’ lives https://t.co/p2rM6rlKxt",66,379,"Two more breakthrough new treatments for Australians living with lung cancer &amp; leukaemia will be listed on the PBS from 1 Dec. Since 2013, we’ve made over 2200 new or amended listings on the PBS. That’s around 1 a day, saving &amp; changing Australians’ lives https://t.co/p2rM6rlKxt "
1197324579837861888,2019-11-21 01:23:19+00:00,"Today, we announced $530m to bring forward 3 major regional road projects in NSW: ✔ Toowoomba to Seymour  ✔ Newell Highway Upgrades   ✔ Princes Highway Corridor It’s part of our $3.8 billion package to bust congestion, drive jobs &amp; the economy &amp; get people home sooner &amp; safer.",40,299,"Today, we announced $530m to bring forward 3 major regional road projects in NSW: ✔ Toowoomba to Seymour  ✔ Newell Highway Upgrades   ✔ Princes Highway Corridor It’s part of our $3.8 billion package to bust congestion, drive jobs &amp; the economy &amp; get people home sooner &amp; safer. "
1197298130640756736,2019-11-20 23:38:13+00:00,"We continue to listen &amp; take action when it comes to #drought. Our latest major step up includes new interest &amp; repayment free loans &amp; more support for drought-affected communities, bringing the extra support announced since May to $1 billion in grants &amp; direct payments alone. https://t.co/2qmAUpapUS",48,282,"We continue to listen &amp; take action when it comes to #drought. Our latest major step up includes new interest &amp; repayment free loans &amp; more support for drought-affected communities, bringing the extra support announced since May to $1 billion in grants &amp; direct payments alone. https://t.co/2qmAUpapUS "
1197004347868999680,2019-11-20 04:10:50+00:00,"Going to be a great summer of cricket, and for our firefighters and fire-impacted communities, I’m sure our boys will give them something to cheer for.  @GabbaBrisbane @CricketAus #AUSvPAK https://t.co/iHF1mGPrAH",182,1104,"Going to be a great summer of cricket, and for our firefighters and fire-impacted communities, I’m sure our boys will give them something to cheer for.  @GabbaBrisbane @CricketAus #AUSvPAK https://t.co/iHF1mGPrAH "
1196998193881333760,2019-11-20 03:46:23+00:00,I visited the @QldFES Centre today to get an update on the current and forecast bushfire conditions. Australia is facing some dangerous fire conditions all across the country in the coming days. Please keep updated on fires in your area. Stay alert. Stay informed. Stay safe. https://t.co/41S8nHjY4t,27,178,I visited the @QldFES Centre today to get an update on the current and forecast bushfire conditions. Australia is facing some dangerous fire conditions all across the country in the coming days. Please keep updated on fires in your area. Stay alert. Stay informed. Stay safe. https://t.co/41S8nHjY4t 
1196953932393639936,2019-11-20 00:50:30+00:00,"An enormous relief that Australian Tim Weeks, who has been held hostage by the Taliban in Afghanistan for 3 years, is safe and on his way home. Our deepest gratitude to the US and Afghan Governments for their assistance. I spoke to @TheTodayShow about his release earlier today. https://t.co/IP01LyttQA",15,138,"An enormous relief that Australian Tim Weeks, who has been held hostage by the Taliban in Afghanistan for 3 years, is safe and on his way home. Our deepest gratitude to the US and Afghan Governments for their assistance. I spoke to @TheTodayShow about his release earlier today. https://t.co/IP01LyttQA "
1196947110370758656,2019-11-20 00:23:23+00:00,"We'll bring forward funding for a total of 20 projects right throughout Queensland, including key upgrades on the M1, Bruce, Warrego and Cunningham Highways. This will drive jobs, boost the economy &amp; make Queensland roads &amp; highways safer. Read more at: https://t.co/9UK5l0HlXF https://t.co/awE7atGIvO",13,111,"We'll bring forward funding for a total of 20 projects right throughout Queensland, including key upgrades on the M1, Bruce, Warrego and Cunningham Highways. This will drive jobs, boost the economy &amp; make Queensland roads &amp; highways safer. Read more at: https://t.co/9UK5l0HlXF https://t.co/awE7atGIvO "
1196944281581178880,2019-11-20 00:12:09+00:00,"We're bringing forward $3.8 billion of new investment into building new roads &amp; rail across the country to get Australians home sooner &amp; safer, strengthen our economy &amp; create new jobs.  Great to chat with @TheTodayShow from Brisbane about it earlier today.  #BuildingOurEconomy https://t.co/EN3CX25PBD",43,347,"We're bringing forward $3.8 billion of new investment into building new roads &amp; rail across the country to get Australians home sooner &amp; safer, strengthen our economy &amp; create new jobs.  Great to chat with @TheTodayShow from Brisbane about it earlier today.  #BuildingOurEconomy https://t.co/EN3CX25PBD "
1196747256537309184,2019-11-19 11:09:15+00:00,"We are profoundly pleased and relieved Australian Tim Weeks &amp; his US colleague, Kevin King, who were held hostage since August 2016, have been released by their kidnappers today in Afghanistan. We convey deep appreciation to the Governments of the United States &amp; Afghanistan.",63,309,"We are profoundly pleased and relieved Australian Tim Weeks &amp; his US colleague, Kevin King, who were held hostage since August 2016, have been released by their kidnappers today in Afghanistan. We convey deep appreciation to the Governments of the United States &amp; Afghanistan. "
1196721888652742656,2019-11-19 09:28:26+00:00,"Bushfire conditions are expected to worsen over the coming days in NSW, Qld &amp; SA. Please ensure you keep updated on fires in your area and continue to listen to, and follow, the instructions of authorities. Stay alert. Stay informed. Stay safe.",51,255,"Bushfire conditions are expected to worsen over the coming days in NSW, Qld &amp; SA. Please ensure you keep updated on fires in your area and continue to listen to, and follow, the instructions of authorities. Stay alert. Stay informed. Stay safe. "
1196687967344947200,2019-11-19 07:13:39+00:00,Aussie Farms encouraged the invasion of farmers' homes &amp; properties &amp; the sabotaging of businesses. It's why we introduced new laws to ban that sort of bullying of our farmers. There’s nothing charitable about it &amp; I welcome news the group’s charity status has now been revoked. https://t.co/sZRm0cVKlj,92,633,Aussie Farms encouraged the invasion of farmers' homes &amp; properties &amp; the sabotaging of businesses. It's why we introduced new laws to ban that sort of bullying of our farmers. There’s nothing charitable about it &amp; I welcome news the group’s charity status has now been revoked. https://t.co/sZRm0cVKlj 
1196300949758734337,2019-11-18 05:35:47+00:00,An honour to unveil the official plans for the Australian War Memorial Project in Canberra today. This is the largest investment in upgrading the Memorial since it was first opened in 1941 #LestWeForget https://t.co/yYE6krDHji,34,224,An honour to unveil the official plans for the Australian War Memorial Project in Canberra today. This is the largest investment in upgrading the Memorial since it was first opened in 1941 #LestWeForget https://t.co/yYE6krDHji 
1196259079804481536,2019-11-18 02:49:24+00:00,"In Adelaide today, we announced a $415m package for South Australia to keep our economy moving by bringing forward projects like the Darlington Upgrade and Flinders Link Projects as well as the Eyre Highway — with Premier @marshall_steven. https://t.co/hGbeeuL08X",35,258,"In Adelaide today, we announced a $415m package for South Australia to keep our economy moving by bringing forward projects like the Darlington Upgrade and Flinders Link Projects as well as the Eyre Highway — with Premier @marshall_steven. https://t.co/hGbeeuL08X "
1194172793048272897,2019-11-12 08:39:15+00:00,I visited the Government’s Crisis Coordination Centre late today to get the latest update on the #bushfires. Thank you to all those responding to these fires for their courageous efforts. We’re not out of this yet so please remain vigilant and stay updated on fires in your area. https://t.co/eDz52kQ6Ih,42,336,I visited the Government’s Crisis Coordination Centre late today to get the latest update on the #bushfires. Thank you to all those responding to these fires for their courageous efforts. We’re not out of this yet so please remain vigilant and stay updated on fires in your area. https://t.co/eDz52kQ6Ih 
1194127139877949440,2019-11-12 05:37:50+00:00,Stay safe Owen. https://t.co/4DqHF5m8ev,53,585,Stay safe Owen. https://t.co/4DqHF5m8ev 
1194025650060840960,2019-11-11 22:54:33+00:00,Everything that can be done is being done to prepare for today’s incredibly dangerous fire conditions in NSW &amp; Qld. The @DeptDefence is ready to go to assist the states and to respond locally with whatever they need. Just spoke to @2GB873 to give an update on preparations.,58,393,Everything that can be done is being done to prepare for today’s incredibly dangerous fire conditions in NSW &amp; Qld. The @DeptDefence is ready to go to assist the states and to respond locally with whatever they need. Just spoke to @2GB873 to give an update on preparations. 
1194018672081162240,2019-11-11 22:26:49+00:00,Queensland is also facing dangerous fire conditions today. Make sure you keep up to date on fires in your area and please listen to and follow the instructions of authorities. https://t.co/kXsfobMUmG,23,124,Queensland is also facing dangerous fire conditions today. Make sure you keep up to date on fires in your area and please listen to and follow the instructions of authorities. https://t.co/kXsfobMUmG 
1194005988015083522,2019-11-11 21:36:25+00:00,NSW is facing a dangerous day ahead with catastrophic fire conditions. Please stay vigilant and listen to and follow the advice of authorities. https://t.co/ujoh0oSF2m,36,135,NSW is facing a dangerous day ahead with catastrophic fire conditions. Please stay vigilant and listen to and follow the advice of authorities. https://t.co/ujoh0oSF2m 
1193705247979405313,2019-11-11 01:41:23+00:00,We will remember them. #LestWeForget #RemembranceDay https://t.co/M2k0AgehWv,49,414,We will remember them. #LestWeForget #RemembranceDay https://t.co/M2k0AgehWv 
1193667545129050112,2019-11-10 23:11:34+00:00,"I welcome the announcement a state of emergency has been declared in NSW. Catastrophic fire danger is forecast for the Greater Sydney &amp; Hunter areas tomorrow. Stay updated on fires in your area &amp; emergency services are advising if you’re in a danger zone, leaving early is best. https://t.co/9N70qP1mCl",112,386,"I welcome the announcement a state of emergency has been declared in NSW. Catastrophic fire danger is forecast for the Greater Sydney &amp; Hunter areas tomorrow. Stay updated on fires in your area &amp; emergency services are advising if you’re in a danger zone, leaving early is best. https://t.co/9N70qP1mCl "
1193437630572060672,2019-11-10 07:57:58+00:00,"Congratulations to my friend and colleague Jim Molan, who I’m pleased has been selected by @LiberalNSW to return to the Senate to replace @A_Sinodinos. Jim will take up where he left off before the election &amp; serve the people of NSW well, especially those in regional areas. https://t.co/18PGcbKVKk",43,453,"Congratulations to my friend and colleague Jim Molan, who I’m pleased has been selected by @LiberalNSW to return to the Senate to replace @A_Sinodinos. Jim will take up where he left off before the election &amp; serve the people of NSW well, especially those in regional areas. https://t.co/18PGcbKVKk "
1193418837154131969,2019-11-10 06:43:18+00:00,"An incredibly emotional day today as I visited Wauchope and Taree, two areas in NSW hit hard by these devastating bushfires to offer my support to those who have been through what can only be described as a harrowing trauma. https://t.co/I4fNpFcBuU",75,574,"An incredibly emotional day today as I visited Wauchope and Taree, two areas in NSW hit hard by these devastating bushfires to offer my support to those who have been through what can only be described as a harrowing trauma. https://t.co/I4fNpFcBuU "
1192993222173188096,2019-11-09 02:32:03+00:00,Our thoughts and prayers are with those who have been so directly and horribly impacted by these fires. https://t.co/XvgsLv4eht,121,703,Our thoughts and prayers are with those who have been so directly and horribly impacted by these fires. https://t.co/XvgsLv4eht 
1192934057857843200,2019-11-08 22:36:57+00:00,"The fires burning in NSW &amp; Queensland are simply terrifying. To those Australians who have lost everything, we are devastated at your loss &amp; we’ll be there to support &amp; rebuild. To all those in affected areas stay safe &amp; please listen to &amp; follow emergency services instructions.",79,442,"The fires burning in NSW &amp; Queensland are simply terrifying. To those Australians who have lost everything, we are devastated at your loss &amp; we’ll be there to support &amp; rebuild. To all those in affected areas stay safe &amp; please listen to &amp; follow emergency services instructions. "
1192727863943806976,2019-11-08 08:57:37+00:00,"Incredibly concerning there are a large number of bushfires burning at emergency levels in NSW &amp; Qld. Please stay safe &amp; listen to emergency services. If you’re life is at risk, call 000. I’m getting regular updates &amp; we stand ready to offer any assistance needed.",85,551,"Incredibly concerning there are a large number of bushfires burning at emergency levels in NSW &amp; Qld. Please stay safe &amp; listen to emergency services. If you’re life is at risk, call 000. I’m getting regular updates &amp; we stand ready to offer any assistance needed. "
1192659626593898497,2019-11-08 04:26:28+00:00,"This Monday is #RemembranceDay when we pause to remember those who made the ultimate sacrifice for Australia. Earlier this week, I had the incredible honour of cleaning the Tomb of the Unknown Soldier at the National War Memorial in Canberra. He is one of us, he is all of us. https://t.co/crE36QszxM",84,535,"This Monday is #RemembranceDay when we pause to remember those who made the ultimate sacrifice for Australia. Earlier this week, I had the incredible honour of cleaning the Tomb of the Unknown Soldier at the National War Memorial in Canberra. He is one of us, he is all of us. https://t.co/crE36QszxM "
