id,created_at,text,rt_count,fav_count,english
903160353592295424,2017-08-31 07:39:42+00:00,This morning I addressed Bloomberg @business about the economics of opportunity the Turnbull Government is creating #auspol #ausbiz https://t.co/ZZnWYdbqJj,1,6,This morning I addressed Bloomberg @business about the economics of opportunity the Turnbull Government is creating #auspol #ausbiz https://t.co/ZZnWYdbqJj 
903134170548912128,2017-08-31 05:55:40+00:00,"Pull on your colours tomorrow for @jerseydayau: raise awareness, join the Organ Donor Register, and help save lives #makeitcount #donatelife https://t.co/RWZ8o3KHQa",6,16,"Pull on your colours tomorrow for @jerseydayau: raise awareness, join the Organ Donor Register, and help save lives #makeitcount #donatelife https://t.co/RWZ8o3KHQa "
902322248127614976,2017-08-29 00:09:22+00:00,Lenders shifting towards principal and interest loans away from interest only is helping keep household debt under control #auspol,3,15,Lenders shifting towards principal and interest loans away from interest only is helping keep household debt under control #auspol 
902321929201131520,2017-08-29 00:08:06+00:00,APRA data shows the wisdom of using the scalpel of regulation on housing markets not Labor's tax sledgehammer #auspol,2,9,APRA data shows the wisdom of using the scalpel of regulation on housing markets not Labor's tax sledgehammer #auspol 
902321718277971971,2017-08-29 00:07:16+00:00,New APRA data shows that measures to curb investor heat in housing markets are working #auspol https://t.co/l900bzpGNS,4,7,New APRA data shows that measures to curb investor heat in housing markets are working #auspol https://t.co/l900bzpGNS 
901994051645276161,2017-08-28 02:25:14+00:00,ICYMI my interview with @SabraLane this morning #auspol  https://t.co/GJyUwkto75,2,4,ICYMI my interview with @SabraLane this morning #auspol  https://t.co/GJyUwkto75 
901928233855094784,2017-08-27 22:03:42+00:00,Chatting to @SabraLane on @amworldtodaypm https://t.co/MvBaJ24lqL,0,1,Chatting to @SabraLane on @amworldtodaypm https://t.co/MvBaJ24lqL 
901317895665221632,2017-08-26 05:38:26+00:00,This is what is changing the lives of young Indigenous Australians. The Clontarf Foundation #auspol https://t.co/InsFJLcC4j,2,32,This is what is changing the lives of young Indigenous Australians. The Clontarf Foundation #auspol https://t.co/InsFJLcC4j 
901309027027623936,2017-08-26 05:03:12+00:00,"A national insult &amp; disgrace. Does not keep one indigenous child safe, in school or end up in a job. Grow up idiots #auspol https://t.co/DorQRPDmEc",251,709,"A national insult &amp; disgrace. Does not keep one indigenous child safe, in school or end up in a job. Grow up idiots #auspol https://t.co/DorQRPDmEc "
901278697679765505,2017-08-26 03:02:41+00:00,It was great to visit the Bourke abattoir construction site with @MarkCoultonMP The $10m Gov grant will help create 200 jobs in Bourke. https://t.co/q1pp7DUnk7,9,25,It was great to visit the Bourke abattoir construction site with @MarkCoultonMP The $10m Gov grant will help create 200 jobs in Bourke. https://t.co/q1pp7DUnk7 
900618926307983360,2017-08-24 07:20:59+00:00,Our record of strong economic management has ensured Australia’s AAA credit rating has been maintained with all 3 major ratings agencies. https://t.co/jHGHU1bYEl,7,25,Our record of strong economic management has ensured Australia’s AAA credit rating has been maintained with all 3 major ratings agencies. https://t.co/jHGHU1bYEl 
900278016927948800,2017-08-23 08:46:20+00:00,"Moody’s has maintained our AAA credit rating once again, completing the trifecta with S&amp;P and Fitch . Better days still ahead.  #auspol",13,66,"Moody’s has maintained our AAA credit rating once again, completing the trifecta with S&amp;P and Fitch . Better days still ahead.  #auspol "
900208176192212994,2017-08-23 04:08:48+00:00,The Turnbull Government continues to crackdown on Labor’s multinational tax loopholes. Over $4 billion raised in ATO assessments last FY. https://t.co/8UzhVrD1Ag,8,22,The Turnbull Government continues to crackdown on Labor’s multinational tax loopholes. Over $4 billion raised in ATO assessments last FY. https://t.co/8UzhVrD1Ag 
900109686720024576,2017-08-22 21:37:27+00:00,ICYMI my interview with @ChrisBathTV on @abcsydney  https://t.co/4LndzBYsdf,0,3,ICYMI my interview with @ChrisBathTV on @abcsydney  https://t.co/4LndzBYsdf 
898001644947779584,2017-08-17 02:00:50+00:00,"210,800 full-time jobs have been created in the last 6 months – the largest 6 month gain since the labour force survey began in 1978 #auspol",4,22,"210,800 full-time jobs have been created in the last 6 months – the largest 6 month gain since the labour force survey began in 1978 #auspol "
898001546373234688,2017-08-17 02:00:27+00:00,Congrats to the 28K Aussies who got a job in July &amp; businesses employing them. Extra 198K full time jobs created so far this year #auspol,3,10,Congrats to the 28K Aussies who got a job in July &amp; businesses employing them. Extra 198K full time jobs created so far this year #auspol 
897991746109427712,2017-08-17 01:21:30+00:00,Today I introduced a bill that will guarantee the NDIS is fully funded. It’s time Parliament comes together to protect our most vulnerable. https://t.co/zPYoFDEFhI,50,123,Today I introduced a bill that will guarantee the NDIS is fully funded. It’s time Parliament comes together to protect our most vulnerable. https://t.co/zPYoFDEFhI 
897366085929807873,2017-08-15 07:55:21+00:00,Bill Shorten has no plans to grow the economy. His only plan is to try and slither his way into The Lodge. https://t.co/RLQsTYJBR8,9,64,Bill Shorten has no plans to grow the economy. His only plan is to try and slither his way into The Lodge. https://t.co/RLQsTYJBR8 
897086435378974720,2017-08-14 13:24:07+00:00,Labor opposed changes - once again putting big unions ahead of small business and consumers.,8,26,Labor opposed changes - once again putting big unions ahead of small business and consumers. 
897086143526707200,2017-08-14 13:22:58+00:00,Govt has secured Senate support (41-19) to protect small biz from anti-competitive conduct - better outcomes for consumers and workers.,11,29,Govt has secured Senate support (41-19) to protect small biz from anti-competitive conduct - better outcomes for consumers and workers. 
896857347871490048,2017-08-13 22:13:49+00:00,Speaking to @Kieran_Gilbert on @SkyNewsAust now #auspol https://t.co/UEy4002iOs,1,4,Speaking to @Kieran_Gilbert on @SkyNewsAust now #auspol https://t.co/UEy4002iOs 
895540211987365889,2017-08-10 06:59:59+00:00,The Coalition believes in the economics of opportunity and lower taxes. The Labor Party only believe in the politics of envy. #auspol https://t.co/nXAmGucbP2,7,39,The Coalition believes in the economics of opportunity and lower taxes. The Labor Party only believe in the politics of envy. #auspol https://t.co/nXAmGucbP2 
895403333602557952,2017-08-09 21:56:05+00:00,Tune into ABC's AM with @SabraLane at 8am @abcnews #auspol https://t.co/gp1CpEc5VK,0,3,Tune into ABC's AM with @SabraLane at 8am @abcnews #auspol https://t.co/gp1CpEc5VK 
895392297440780288,2017-08-09 21:12:13+00:00,About to chat with @kochie_online on @sunriseon7,1,4,About to chat with @kochie_online on @sunriseon7 
894836479276457984,2017-08-08 08:23:36+00:00,I am encouraged that businesses are seeing better days ahead. This means better days for their employees. https://t.co/Jzac20oFcA,11,41,I am encouraged that businesses are seeing better days ahead. This means better days for their employees. https://t.co/Jzac20oFcA 
894733914085900288,2017-08-08 01:36:03+00:00,NAB biz confidence one of the strongest results since 2010  – double the long-run average #auspol #ausbiz,1,1,NAB biz confidence one of the strongest results since 2010  – double the long-run average #auspol #ausbiz 
894733405492920321,2017-08-08 01:34:01+00:00,Better days ahead: NAB biz conditions strongest since GFC (Jan-08) – three times the long-run average #auspol #ausbiz,4,5,Better days ahead: NAB biz conditions strongest since GFC (Jan-08) – three times the long-run average #auspol #ausbiz 
894372818833465345,2017-08-07 01:41:11+00:00,Jobs ads up 1.5% in July - 12.8% over the past year – strongest annual growth in almost 2 years. #auspol,6,29,Jobs ads up 1.5% in July - 12.8% over the past year – strongest annual growth in almost 2 years. #auspol 
893246880376791040,2017-08-03 23:07:06+00:00,"My chat with @BIAUS - FinTech, open banking, wage growth and the economic outlook. https://t.co/yM8qcmD9sF",4,3,"My chat with @BIAUS - FinTech, open banking, wage growth and the economic outlook. https://t.co/yM8qcmD9sF "
892255599412379648,2017-08-01 05:28:06+00:00,"To improve living standards, lift wages &amp; get people into jobs, don't follow the politics of envy – follow the economics of opportunity. https://t.co/XOjUXTKftR",25,69,"To improve living standards, lift wages &amp; get people into jobs, don't follow the politics of envy – follow the economics of opportunity. https://t.co/XOjUXTKftR "
892208389815640064,2017-08-01 02:20:31+00:00,A constructive meeting with @benwyatt on WA GST. Will keep working together on a solution. #auspol https://t.co/eEaU5KJcVj,8,19,A constructive meeting with @benwyatt on WA GST. Will keep working together on a solution. #auspol https://t.co/eEaU5KJcVj 
892172813104062464,2017-07-31 23:59:09+00:00,Australians are rejecting Shorten's undermining of confidence in our economy. BS has no plan for growth #auspol,5,18,Australians are rejecting Shorten's undermining of confidence in our economy. BS has no plan for growth #auspol 
892172370131116032,2017-07-31 23:57:23+00:00,Confidence in economic conditions now at highest level since Sept 2013 #auspol,8,13,Confidence in economic conditions now at highest level since Sept 2013 #auspol 
891806336819777536,2017-07-30 23:42:54+00:00,"Bill Shorten wants more people on lower incomes, not to help those on lower incomes earn more. #auspol",5,40,"Bill Shorten wants more people on lower incomes, not to help those on lower incomes earn more. #auspol "
891805431571533824,2017-07-30 23:39:18+00:00,"If Bill Shorten is elected, it will be whacking day for small businesses. #auspol",10,42,"If Bill Shorten is elected, it will be whacking day for small businesses. #auspol "
891805247722602500,2017-07-30 23:38:34+00:00,Labor think that only one member of the family is part of the family business #auspol,2,12,Labor think that only one member of the family is part of the family business #auspol 
891805117577445376,2017-07-30 23:38:03+00:00,"Shorten has confirmed his new Family Business Tax will hit at least 200,000 small businesses #auspol",12,37,"Shorten has confirmed his new Family Business Tax will hit at least 200,000 small businesses #auspol "
891529670872580097,2017-07-30 05:23:32+00:00,Labor's Trust tax doesn't create one job or increase one wage. Labor have given up on growth.,20,90,Labor's Trust tax doesn't create one job or increase one wage. Labor have given up on growth. 
890701206317801472,2017-07-27 22:31:30+00:00,On Sky News with @tomwconnell in a couple of minutes #auspol,0,6,On Sky News with @tomwconnell in a couple of minutes #auspol 
890436529444618240,2017-07-27 04:59:46+00:00,"Bit of light reading for the flight home to Sydney from Adelaide, #justbeingcheeky https://t.co/8spMDDKtti",16,78,"Bit of light reading for the flight home to Sydney from Adelaide, #justbeingcheeky https://t.co/8spMDDKtti "
890022596351107072,2017-07-26 01:34:57+00:00,Here in Adelaide about to talk to @LeonByner5AA #auspol https://t.co/tzNKSgiJiV,3,5,Here in Adelaide about to talk to @LeonByner5AA #auspol https://t.co/tzNKSgiJiV 
889630893383536640,2017-07-24 23:38:28+00:00,Graph source: @RogerWilkins_au https://t.co/g6vU8peg0M,2,4,Graph source: @RogerWilkins_au https://t.co/g6vU8peg0M 
889621351857885186,2017-07-24 23:00:33+00:00,I'll be catching up with John Laws on 2SM just after 9am. #auspol,0,4,I'll be catching up with John Laws on 2SM just after 9am. #auspol 
889367793971322881,2017-07-24 06:13:00+00:00,The Turnbull Government believes in growing the economy to increase the number of jobs and increase people’s wages. https://t.co/wndAhtEyCC,7,32,The Turnbull Government believes in growing the economy to increase the number of jobs and increase people’s wages. https://t.co/wndAhtEyCC 
889326103730438145,2017-07-24 03:27:20+00:00,My chat with Fran Kelly on RN Breakfast this morning https://t.co/S8FKhtts4k,4,5,My chat with Fran Kelly on RN Breakfast this morning https://t.co/S8FKhtts4k 
889238439681441793,2017-07-23 21:38:59+00:00,RN right now with @frankelly08 @abcnews https://t.co/aMzwOBurRc,2,3,RN right now with @frankelly08 @abcnews https://t.co/aMzwOBurRc 
888241185050968064,2017-07-21 03:36:15+00:00,Last night I spoke with @leighsales on @abc730 about Australia's better days ahead #auspol https://t.co/HIEAzyhB0r,6,7,Last night I spoke with @leighsales on @abc730 about Australia's better days ahead #auspol https://t.co/HIEAzyhB0r 
887953219359457280,2017-07-20 08:31:59+00:00,I spent the morning with @MichaelSukkarMP at Jubilee's Burwood community housing site.   https://t.co/ttWhDSz3Fs,2,6,I spent the morning with @MichaelSukkarMP at Jubilee's Burwood community housing site.   https://t.co/ttWhDSz3Fs 
887925013503811584,2017-07-20 06:39:54+00:00,Live with @TomElliott3AW now https://t.co/pxm3PJXzrI,1,2,Live with @TomElliott3AW now https://t.co/pxm3PJXzrI 
887865898337353728,2017-07-20 02:45:00+00:00,Over 240K jobs created in 2016-17. Strongest financial year result in almost a decade. 62K full-time jobs created in June #auspol,14,40,Over 240K jobs created in 2016-17. Strongest financial year result in almost a decade. 62K full-time jobs created in June #auspol 
887860060465971201,2017-07-20 02:21:48+00:00,NAB Business Conditions now at their highest level since March quarter 2008 at +13 points. Biz confidence above average #auspol,1,7,NAB Business Conditions now at their highest level since March quarter 2008 at +13 points. Biz confidence above average #auspol 
887226412972638208,2017-07-18 08:23:55+00:00,This Government is doing everything we can to keep Australians safe. That’s why we will establish a Home Affairs portfolio. https://t.co/VzeVoMHaFu,3,22,This Government is doing everything we can to keep Australians safe. That’s why we will establish a Home Affairs portfolio. https://t.co/VzeVoMHaFu 
886835213992468480,2017-07-17 06:29:26+00:00,New Turnbull Government reforms will mean more competitive loans &amp; a more competitive banking system for Aussies.  https://t.co/cEabVeieVa,6,9,New Turnbull Government reforms will mean more competitive loans &amp; a more competitive banking system for Aussies.  https://t.co/cEabVeieVa 
882776438239150080,2017-07-06 01:41:18+00:00,Labor's goal of higher taxes is a dark economic vision for Australia and is rejected by the Turnbull Government. https://t.co/8bvyACRLwW,12,34,Labor's goal of higher taxes is a dark economic vision for Australia and is rejected by the Turnbull Government. https://t.co/8bvyACRLwW 
882771892364492804,2017-07-06 01:23:14+00:00,"Approval for the acquisition of Arrium's Iron and Steel Assets. Good news for Whyalla, jobs, Australian steel manufacturing and our economy. https://t.co/EM3x69pYM3",12,34,"Approval for the acquisition of Arrium's Iron and Steel Assets. Good news for Whyalla, jobs, Australian steel manufacturing and our economy. https://t.co/EM3x69pYM3 "
882467409566748672,2017-07-05 05:13:20+00:00,My chat with Bloomberg today as the PM heads off to the G20. #auspol  https://t.co/40AORtSgv6,0,5,My chat with Bloomberg today as the PM heads off to the G20. #auspol  https://t.co/40AORtSgv6 
881788142549745666,2017-07-03 08:14:10+00:00,"Housing data today confirms moderating price growth due to careful prudential changes. We're using a scalpel, not Labor's tax sledgehammer https://t.co/7ggpbDS0KC",5,18,"Housing data today confirms moderating price growth due to careful prudential changes. We're using a scalpel, not Labor's tax sledgehammer https://t.co/7ggpbDS0KC "
881691456993230848,2017-07-03 01:49:59+00:00,Over 175K jobs advertised in June and over 170K in May. 10.5% annual growth. Job ads now at highest level since June 2011 #auspol,8,27,Over 175K jobs advertised in June and over 170K in May. 10.5% annual growth. Job ads now at highest level since June 2011 #auspol 
880992161361125377,2017-07-01 03:31:13+00:00,From today 1st home buyers will be given access to a tax cut that will accelerate their savings by at least 30% https://t.co/7nSRzFp2pV https://t.co/q3ZXRuExli,12,19,From today 1st home buyers will be given access to a tax cut that will accelerate their savings by at least 30% https://t.co/7nSRzFp2pV https://t.co/q3ZXRuExli 
880637944943464448,2017-06-30 04:03:42+00:00,Speaking in WA today to highlight the Turnbull Govt’s actions in examining whether the way GST revenue is distributed harms economic growth. https://t.co/ljVx5XEdaT,7,18,Speaking in WA today to highlight the Turnbull Govt’s actions in examining whether the way GST revenue is distributed harms economic growth. https://t.co/ljVx5XEdaT 
880315388411625472,2017-06-29 06:41:58+00:00,Great to be with @KenWyattMP and @SteveIronsMP discussing Turnbull Govt investment in WA infrastructure &amp; our review into GST distribution https://t.co/3TcPOLmeau,3,15,Great to be with @KenWyattMP and @SteveIronsMP discussing Turnbull Govt investment in WA infrastructure &amp; our review into GST distribution https://t.co/3TcPOLmeau 
880015041407328256,2017-06-28 10:48:30+00:00,Great seeing you in the NT Matt Williams @TheNTNews https://t.co/9GkpMT46ax,14,29,Great seeing you in the NT Matt Williams @TheNTNews https://t.co/9GkpMT46ax 
879841599353520129,2017-06-27 23:19:18+00:00,"New, targeted home loan rules are far better than a hard landing on house prices from abolishing negative gearing #auspol",2,8,"New, targeted home loan rules are far better than a hard landing on house prices from abolishing negative gearing #auspol "
879840017455038465,2017-06-27 23:13:01+00:00,New rules to restrict interest only and investor housing loans are working #auspol,1,6,New rules to restrict interest only and investor housing loans are working #auspol 
879833922908995584,2017-06-27 22:48:48+00:00,"Our housing plan is supporting renters - more supply, especially for affordable rental housing #auspol https://t.co/rIvSNag5ih",2,4,"Our housing plan is supporting renters - more supply, especially for affordable rental housing #auspol https://t.co/rIvSNag5ih "
879832727729471488,2017-06-27 22:44:03+00:00,Census shows that rents are rising. Abolishing negative gearing would make life tougher for renters #auspol,7,26,Census shows that rents are rising. Abolishing negative gearing would make life tougher for renters #auspol 
879168916383080448,2017-06-26 02:46:18+00:00,My interview with @2GB873 to discuss my address to the Liberal Party Federal Council.   https://t.co/wl4PwmgVZD,2,7,My interview with @2GB873 to discuss my address to the Liberal Party Federal Council.   https://t.co/wl4PwmgVZD 
879086137851039744,2017-06-25 21:17:22+00:00,Catch me on @sunriseon7 with @kochie_online in a couple of minutes #auspol https://t.co/3701NM3p1l,1,2,Catch me on @sunriseon7 with @kochie_online in a couple of minutes #auspol https://t.co/3701NM3p1l 
878457107024035840,2017-06-24 03:37:49+00:00,"The Turnbull Government is on the side of Australians, on the issues that matter to them. #LibCouncil #auspol https://t.co/3fD9cA0Lu8",5,15,"The Turnbull Government is on the side of Australians, on the issues that matter to them. #LibCouncil #auspol https://t.co/3fD9cA0Lu8 "
878156939045216256,2017-06-23 07:45:04+00:00,The Turnbull Government is taking action to put more power in the hands of Australians &amp; protect them from predatory credit card practices. https://t.co/Npp6VHYdFR,4,13,The Turnbull Government is taking action to put more power in the hands of Australians &amp; protect them from predatory credit card practices. https://t.co/Npp6VHYdFR 
878135898751123456,2017-06-23 06:21:27+00:00,The Turnbull Government is on the side of Aussies struggling with credit card debt. We are acting to protect you from credit card sharks. https://t.co/bBZb44Rw8t,6,16,The Turnbull Government is on the side of Aussies struggling with credit card debt. We are acting to protect you from credit card sharks. https://t.co/bBZb44Rw8t 
878079397588221954,2017-06-23 02:36:56+00:00,"When people are under financial pressure, we don’t want them to be taken advantage of by credit card sharks.  https://t.co/8w3arU88Y4",3,20,"When people are under financial pressure, we don’t want them to be taken advantage of by credit card sharks.  https://t.co/8w3arU88Y4 "
877785826066710529,2017-06-22 07:10:24+00:00,"Before the end of the year, the Government will introduce a suite of measures to force credit card providers to scrap unfair practices. https://t.co/RSgiAWD5aA",6,17,"Before the end of the year, the Government will introduce a suite of measures to force credit card providers to scrap unfair practices. https://t.co/RSgiAWD5aA "
877675659262214144,2017-06-21 23:52:38+00:00,We're making 4 significant changes to swing the credit card pendulum back in favour of Aussie customers.  https://t.co/On5KXXP3zn,11,20,We're making 4 significant changes to swing the credit card pendulum back in favour of Aussie customers.  https://t.co/On5KXXP3zn 
877470321741144065,2017-06-21 10:16:41+00:00,The Govt has legislated to level the playing field for Aussie businesses by applying GST to multinationals. https://t.co/pi8oXOH7nj,15,27,The Govt has legislated to level the playing field for Aussie businesses by applying GST to multinationals. https://t.co/pi8oXOH7nj 
877123958146859008,2017-06-20 11:20:22+00:00,This little bloke is looking forward to having a chat with @pm_live about last weekend's game against the Tigers #upupcronullla https://t.co/WHZXeRgQOH,1,15,This little bloke is looking forward to having a chat with @pm_live about last weekend's game against the Tigers #upupcronullla https://t.co/WHZXeRgQOH 
877093402575126529,2017-06-20 09:18:57+00:00,The Turnbull Government is making sure multinationals pay their fair share of tax in this country. https://t.co/LJlMwSiCfL,11,38,The Turnbull Government is making sure multinationals pay their fair share of tax in this country. https://t.co/LJlMwSiCfL 
876692699465699328,2017-06-19 06:46:42+00:00,We'll continue to do what's needed to put downward pressure on electricity prices. To grow our economy we need reliable &amp; affordable energy. https://t.co/vDka92jgia,10,23,We'll continue to do what's needed to put downward pressure on electricity prices. To grow our economy we need reliable &amp; affordable energy. https://t.co/vDka92jgia 
875514749378633728,2017-06-16 00:45:57+00:00,"I spoke with @BenFordham about 50K Aussies who got jobs over May, dropping unemployment to it's lowest rate in 4 yrs https://t.co/SeH4EoCldX",5,29,"I spoke with @BenFordham about 50K Aussies who got jobs over May, dropping unemployment to it's lowest rate in 4 yrs https://t.co/SeH4EoCldX "
875264043983949824,2017-06-15 08:09:44+00:00,The Turnbull Government is taking comprehensive action to protect Australians from predatory credit card practices. https://t.co/Sjl4D0YzZr,5,15,The Turnbull Government is taking comprehensive action to protect Australians from predatory credit card practices. https://t.co/Sjl4D0YzZr 
875171710055481344,2017-06-15 02:02:50+00:00,"An extra 52,100 full time jobs created in May. Full-time employment has increased by 148,000 in the past year #jobsandgrowth",6,32,"An extra 52,100 full time jobs created in May. Full-time employment has increased by 148,000 in the past year #jobsandgrowth "
875170488846176256,2017-06-15 01:57:59+00:00,42K jobs created in May. Jobless rate (5.5%) lowest since Feb 2013. Congrats to those Aussies employed and the businesses who hired them.,13,55,42K jobs created in May. Jobless rate (5.5%) lowest since Feb 2013. Congrats to those Aussies employed and the businesses who hired them. 
874736392634417152,2017-06-13 21:13:02+00:00,About to chat with @SabraLane on AM @abcnews #auspol https://t.co/VgwFjkmZDC,0,8,About to chat with @SabraLane on AM @abcnews #auspol https://t.co/VgwFjkmZDC 
873060078495989760,2017-06-09 06:11:58+00:00,"Global growth forecasts continue to improve &amp; the OECD, IMF &amp; RBA forecast a return to real growth at around 3% over the next couple of yrs https://t.co/WkBdw00pNI",4,16,"Global growth forecasts continue to improve &amp; the OECD, IMF &amp; RBA forecast a return to real growth at around 3% over the next couple of yrs https://t.co/WkBdw00pNI "
872315273755406340,2017-06-07 04:52:22+00:00,"Today’s National Accounts showed that real GDP rose by 0.3 per cent in the March quarter, to be 1.7 per cent higher through the year #auspol https://t.co/WWfoCqyhvA",8,18,"Today’s National Accounts showed that real GDP rose by 0.3 per cent in the March quarter, to be 1.7 per cent higher through the year #auspol https://t.co/WWfoCqyhvA "
871562655529435136,2017-06-05 03:01:44+00:00,"Almost 170,000 jobs advertised in May. Jobs ads now at the highest level since August 2011 #auspol",9,31,"Almost 170,000 jobs advertised in May. Jobs ads now at the highest level since August 2011 #auspol "
870111952084770817,2017-06-01 02:57:09+00:00,"A tremendous win to the Blues last night. In the 28-4 win, 16 points were scored by Sharks players #justsaying https://t.co/uh2q7GrFCc",3,26,"A tremendous win to the Blues last night. In the 28-4 win, 16 points were scored by Sharks players #justsaying https://t.co/uh2q7GrFCc "
