id,created_at,text,rt_count,fav_count,english
1069413866071777280,2018-12-03 02:11:49+00:00,"Optimism was rewarded with progress at #G20Summit2018. I commend Presidents Trump &amp; Xi for listening to the concerns of other major economies, including Australia. There’s more work to do, but we’ll be encouraging China &amp; the US to work constructively in the months ahead. https://t.co/llqfHgCRmb",34,158,"Optimism was rewarded with progress at #G20Summit2018. I commend Presidents Trump &amp; Xi for listening to the concerns of other major economies, including Australia. There’s more work to do, but we’ll be encouraging China &amp; the US to work constructively in the months ahead. https://t.co/llqfHgCRmb "
1069386459503722496,2018-12-03 00:22:54+00:00,Wishing the Jewish community celebrating over the coming days a blessed and Happy Chanukah. May it bring peace and joy to you and your family. Chanukah Sameach.,69,425,Wishing the Jewish community celebrating over the coming days a blessed and Happy Chanukah. May it bring peace and joy to you and your family. Chanukah Sameach. 
1068798326114402304,2018-12-01 09:25:52+00:00,"[1/2] Australians join with the American people to mourn the loss of President George H. W. Bush. The President was a true and great friend of Australia, who fought for freedom and democracy, not only as President and throughout his public life, but as a WW2 veteran.",101,489,"[1/2] Australians join with the American people to mourn the loss of President George H. W. Bush. The President was a true and great friend of Australia, who fought for freedom and democracy, not only as President and throughout his public life, but as a WW2 veteran. "
1068654865541357568,2018-11-30 23:55:49+00:00,Trade works. That’s my message to our friends and partners at the #G20Summit2018. A productive first day of discussions including with Presidents @realDonaldTrump and @EmmanuelMacron. https://t.co/82PNFJGkdj,64,258,Trade works. That’s my message to our friends and partners at the #G20Summit2018. A productive first day of discussions including with Presidents @realDonaldTrump and @EmmanuelMacron. https://t.co/82PNFJGkdj 
1068597313466097664,2018-11-30 20:07:07+00:00,"Dave Sharma is an outstanding Liberal who has already got things done for the people of Wentworth, and would do even more as part of our government. I’m looking forward to campaigning with him for lower taxes and a stronger economy.",67,395,"Dave Sharma is an outstanding Liberal who has already got things done for the people of Wentworth, and would do even more as part of our government. I’m looking forward to campaigning with him for lower taxes and a stronger economy. "
1068454016286224384,2018-11-30 10:37:43+00:00,Looking forward to meeting with President Trump later today in Buenos Aires at the G20. We both know that a strong economy and national security is the foundation for everything else. https://t.co/QAkdEMqKSy,90,456,Looking forward to meeting with President Trump later today in Buenos Aires at the G20. We both know that a strong economy and national security is the foundation for everything else. https://t.co/QAkdEMqKSy 
1068275434188468224,2018-11-29 22:48:05+00:00,We’re bringing electricity prices down. Our big stick legislation is pressuring energy companies to give Australian families better prices. And it’s working. https://t.co/xFogPdRMot,68,359,We’re bringing electricity prices down. Our big stick legislation is pressuring energy companies to give Australian families better prices. And it’s working. https://t.co/xFogPdRMot 
1067716580589527042,2018-11-28 09:47:24+00:00,"[1/3] Tonight, we all stand with Queenslanders as bushfires burn across the state, threatening homes and communities.  These catastrophic fire conditions are unprecedented for the State. I ask that Queenslanders to please heed the warnings and advice of local fire authorities.",53,248,"[1/3] Tonight, we all stand with Queenslanders as bushfires burn across the state, threatening homes and communities.  These catastrophic fire conditions are unprecedented for the State. I ask that Queenslanders to please heed the warnings and advice of local fire authorities. "
1067019108149940224,2018-11-26 11:35:54+00:00,"Farewell, Bonita Mabo. Your wisdom and open heart will be missed but your legacy will remain strong. A South Sea Islander woman and wife of Eddie Mabo, Bonita will be remembered for her tireless efforts to advance indigenous education as well as land and sea rights.",43,232,"Farewell, Bonita Mabo. Your wisdom and open heart will be missed but your legacy will remain strong. A South Sea Islander woman and wife of Eddie Mabo, Bonita will be remembered for her tireless efforts to advance indigenous education as well as land and sea rights. "
1066881745205714944,2018-11-26 02:30:04+00:00,"Meet the people who will be affected by Labor's Retiree Tax, which will steal the tax refunds of retirees and low income earners. https://t.co/Wi6LWD7bOL",144,387,"Meet the people who will be affected by Labor's Retiree Tax, which will steal the tax refunds of retirees and low income earners. https://t.co/Wi6LWD7bOL "
1066561104627720193,2018-11-25 05:15:57+00:00,Fantastic win by @SouthernStars - World T20 Champions for the fourth time! Well done! https://t.co/xD5QsaKCeT,70,518,Fantastic win by @SouthernStars - World T20 Champions for the fourth time! Well done! https://t.co/xD5QsaKCeT 
1065781845139189760,2018-11-23 01:39:27+00:00,Congratulations to the @SouthernStars on a fantastic win in the @WorldT20 semi-final! One more to go!  https://t.co/xdidfSP3Nb,12,92,Congratulations to the @SouthernStars on a fantastic win in the @WorldT20 semi-final! One more to go!  https://t.co/xdidfSP3Nb 
1065732084759556096,2018-11-22 22:21:44+00:00,"I remember Labor in Government last time. And don’t get me started on 50,000 illegal arrivals and blowing the Budget #dontriskLabor https://t.co/wrPCc8FPri",209,675,"I remember Labor in Government last time. And don’t get me started on 50,000 illegal arrivals and blowing the Budget #dontriskLabor https://t.co/wrPCc8FPri "
1065716178897629184,2018-11-22 21:18:31+00:00,The Coalition Government is making parental leave pay more flexible to give families more choice.  For more info on the changes and the Women's Economic Security Statement: https://t.co/2aKP1brmVH https://t.co/E7hBGFRFA7,32,121,The Coalition Government is making parental leave pay more flexible to give families more choice.  For more info on the changes and the Women's Economic Security Statement: https://t.co/2aKP1brmVH https://t.co/E7hBGFRFA7 
1065056835189624832,2018-11-21 01:38:31+00:00,"[1/6] Extremist radical Islam is a serious problem. We all have responsibilities to make Australia safe, and that means making sure Muslim communities do not become infiltrated with this dangerous ideology.",233,1124,"[1/6] Extremist radical Islam is a serious problem. We all have responsibilities to make Australia safe, and that means making sure Muslim communities do not become infiltrated with this dangerous ideology. "
1064984579885326337,2018-11-20 20:51:24+00:00,Labor’s plan to remove gender from birth certificates in Tasmania is ridiculous. Bill Shorten should step up and commit to put motion to ALP Federal Conference to outlaw it.,331,1948,Labor’s plan to remove gender from birth certificates in Tasmania is ridiculous. Bill Shorten should step up and commit to put motion to ALP Federal Conference to outlaw it. 
1064715515266879488,2018-11-20 03:02:14+00:00,"At Cabinet today we paused to remember Sisto. I was pleased that Jen was able to attend with my Assistant Minister @SteveIronsMP. We’ll miss you, Sisto. Your memory will always remind us of why we value life, love and freedom so much.  https://t.co/Z8jufSff3N",38,198,"At Cabinet today we paused to remember Sisto. I was pleased that Jen was able to attend with my Assistant Minister @SteveIronsMP. We’ll miss you, Sisto. Your memory will always remind us of why we value life, love and freedom so much.  https://t.co/Z8jufSff3N "
1064409540756627456,2018-11-19 06:46:24+00:00,"A day of honouring the valiant men and women who gave their lives to protect our nation, and those who continue to selflessly serve in our armed forces. A humbling experience at Bomana War Cemetery, before meeting the crew and troops onboard HMAS Adelaide in PNG. https://t.co/Dj4nUppiRK",31,297,"A day of honouring the valiant men and women who gave their lives to protect our nation, and those who continue to selflessly serve in our armed forces. A humbling experience at Bomana War Cemetery, before meeting the crew and troops onboard HMAS Adelaide in PNG. https://t.co/Dj4nUppiRK "
1064114671446241285,2018-11-18 11:14:42+00:00,"Great second day at #APEC2018, including signing a partnership to provide electricity to 70% of PNG by 2030, opening the Australian funded School of Business and Public Policy at the University of PNG, and hosting a family BBQ for Pacific Leaders. https://t.co/cdS8Ux1ZGj",50,208,"Great second day at #APEC2018, including signing a partnership to provide electricity to 70% of PNG by 2030, opening the Australian funded School of Business and Public Policy at the University of PNG, and hosting a family BBQ for Pacific Leaders. https://t.co/cdS8Ux1ZGj "
1063974405016047617,2018-11-18 01:57:20+00:00,Hanging out with President Moon after the Socceroos drew 1-1 with South Korea last night  #APEC2018 https://t.co/rGqAlnY4Ur,150,518,Hanging out with President Moon after the Socceroos drew 1-1 with South Korea last night  #APEC2018 https://t.co/rGqAlnY4Ur 
1063720755744006144,2018-11-17 09:09:25+00:00,Meeting with Pacific leaders in Port Moresby. Our Pacific family. #APEC2018 https://t.co/B4J6YaNrgc,75,297,Meeting with Pacific leaders in Port Moresby. Our Pacific family. #APEC2018 https://t.co/B4J6YaNrgc 
1063329402975485952,2018-11-16 07:14:20+00:00,"Today was a day of healing for Darwin, and all Australians, with the first visit by a Japanese Prime Minister, @AbeShinzo, to the city. Together we acknowledge the sensitivities of our past and celebrated our reconciliation, strong partnership and shared agenda for the future. https://t.co/5QgwCwSUeA",197,635,"Today was a day of healing for Darwin, and all Australians, with the first visit by a Japanese Prime Minister, @AbeShinzo, to the city. Together we acknowledge the sensitivities of our past and celebrated our reconciliation, strong partnership and shared agenda for the future. https://t.co/5QgwCwSUeA "
1063276670029709312,2018-11-16 03:44:47+00:00,"We’re backing Darwin and we’re backing the Northern Territory with a City Deal. It’s all three levels of government working together to boost the local economy, create jobs and support businesses.   For more info: https://t.co/ntct5USfFh https://t.co/bi0UqIYuTG",27,119,"We’re backing Darwin and we’re backing the Northern Territory with a City Deal. It’s all three levels of government working together to boost the local economy, create jobs and support businesses.   For more info: https://t.co/ntct5USfFh https://t.co/bi0UqIYuTG "
1062876153550012416,2018-11-15 01:13:16+00:00,"More than 1,000 Australians are remembered here including Private Burke, a 17 year old from Cloncurry. ANZAC Day’s never the same after you’ve visited a place like the Kranji War Cemetary. https://t.co/YTo8xNxIjx",34,217,"More than 1,000 Australians are remembered here including Private Burke, a 17 year old from Cloncurry. ANZAC Day’s never the same after you’ve visited a place like the Kranji War Cemetary. https://t.co/YTo8xNxIjx "
1062672965190352896,2018-11-14 11:45:53+00:00,"Pleased to meet China’s Premier Li Keqiang for our Annual Leaders’ Meeting, reinforcing our commitment to our long-standing and constructive relationship  #ASEAN2018 https://t.co/ccqV0RVjhk",34,128,"Pleased to meet China’s Premier Li Keqiang for our Annual Leaders’ Meeting, reinforcing our commitment to our long-standing and constructive relationship  #ASEAN2018 https://t.co/ccqV0RVjhk "
1062564482851819520,2018-11-14 04:34:48+00:00,Great to see Indonesian President @jokowi for another constructive discussion  #asean2018 https://t.co/Z7duog4JUE,40,129,Great to see Indonesian President @jokowi for another constructive discussion  #asean2018 https://t.co/Z7duog4JUE 
1062554291108380673,2018-11-14 03:54:18+00:00,Very pleased to see the wage growth in the September Qtr and through the year picking up and beating inflation. This has been backed up by a further boost in consumer confidence #astrongereconomy,41,256,Very pleased to see the wage growth in the September Qtr and through the year picking up and beating inflation. This has been backed up by a further boost in consumer confidence #astrongereconomy 
1062078060613103616,2018-11-12 20:21:56+00:00,[1/3] Yesterday I promised to review the Foodbank decision. I have listened and decided to increase the Food Relief budget by $1.5 million over the next 4.5 years and have asked the Minister to place more focus on relief in drought affected areas.,123,533,[1/3] Yesterday I promised to review the Foodbank decision. I have listened and decided to increase the Food Relief budget by $1.5 million over the next 4.5 years and have asked the Minister to place more focus on relief in drought affected areas. 
1061740490620424192,2018-11-11 22:00:33+00:00,Congratulations to @QldPolice on their investigation into recent strawberry tampering and the arrest announced yesterday. We now let the courts do their job.,67,433,Congratulations to @QldPolice on their investigation into recent strawberry tampering and the arrest announced yesterday. We now let the courts do their job. 
1061134459792064512,2018-11-10 05:52:24+00:00,My message to Australians today. https://t.co/4LtWkuFzj7,348,1207,My message to Australians today. https://t.co/4LtWkuFzj7 
1060840663019745280,2018-11-09 10:24:58+00:00,https://t.co/pUXrWIadqi,131,497,Https: // His .CO / PU X RW IA short term 
1060729782088884224,2018-11-09 03:04:22+00:00,"Proud to support @SoldierOnAust in #StrongerTogether18 with @PaulGallen13.  Make sure you get involved, take the challenge and don't forget to donate at https://t.co/3s43RkKSJ6. https://t.co/NinHvZ6jCW",35,137,"Proud to support @SoldierOnAust in #StrongerTogether18 with @PaulGallen13.  Make sure you get involved, take the challenge and don't forget to donate at https://t.co/3s43RkKSJ6. https://t.co/NinHvZ6jCW "
1059984028097335297,2018-11-07 01:41:00+00:00,We're backing Queenslanders by connecting up the north to the south to keep the economy moving. https://t.co/PgZEn7VdnL,35,202,We're backing Queenslanders by connecting up the north to the south to keep the economy moving. https://t.co/PgZEn7VdnL 
1059692998445780992,2018-11-06 06:24:33+00:00,"Vale Ted Mack - a dedicated and respected servant of his community at all levels of government who cared deeply about his city and his country. Thank you, Ted, for what you did and how you did it. My deepest sympathies and condolences to his family, friends and many supporters.",30,144,"Vale Ted Mack - a dedicated and respected servant of his community at all levels of government who cared deeply about his city and his country. Thank you, Ted, for what you did and how you did it. My deepest sympathies and condolences to his family, friends and many supporters. "
1059687781725687809,2018-11-06 06:03:49+00:00,#MelbourneCup https://t.co/xpJ85u2d6E,13,94,#MelbourneCup https://t.co/xpJ85u2d6E 
1059687714990129152,2018-11-06 06:03:33+00:00,#MelbourneCup https://t.co/PKfWfVSvR7,10,67,#MelbourneCup https://t.co/PKfWfVSvR7 
1059686457730752512,2018-11-06 05:58:34+00:00," #MelbourneCup at Caloundra, QLD  https://t.co/GHl4Phdixh",8,111,"#MelbourneCup at Caloundra, QLD  https://t.co/GHl4Phdixh "
1059549470881308672,2018-11-05 20:54:13+00:00,"I’m backing Youngstar today. Would be a wonderful Cup moment if she were to bring it home, and to honour the memory of young Olivia Inglis. All the best to Craig Williams and Chris Waller and the Inglis family. https://t.co/lQVyRGoFRt",32,163,"I’m backing Youngstar today. Would be a wonderful Cup moment if she were to bring it home, and to honour the memory of young Olivia Inglis. All the best to Craig Williams and Chris Waller and the Inglis family. https://t.co/lQVyRGoFRt "
1059546653055537152,2018-11-05 20:43:02+00:00,"If you’re after my Oz playlist, this is the one that has joined me on Syd-Canberra-Syd drives for years. (With a few Kiwis thrown in.)  https://t.co/hwQid8G826",33,185,"If you’re after my Oz playlist, this is the one that has joined me on Syd-Canberra-Syd drives for years. (With a few Kiwis thrown in.)  https://t.co/hwQid8G826 "
1059316658483806208,2018-11-05 05:29:07+00:00, Broadbeach ➡️ Chambers Flat Strawberry Farm Today we announced Working Holiday Maker visa changes to support our farmers and their local communities. #BackingQueenslanders https://t.co/zjyQF1AqsA,59,326,Broadbeach ➡️ Chambers Flat Strawberry Farm Today we announced Working Holiday Maker visa changes to support our farmers and their local communities. #BackingQueenslanders https://t.co/zjyQF1AqsA 
1059241619520548864,2018-11-05 00:30:56+00:00,My thank you message to @Mick_Fanning's mum. https://t.co/zpWa5CAYhy,71,445,My thank you message to @Mick_Fanning's mum. https://t.co/zpWa5CAYhy 
1058958010943385601,2018-11-04 05:43:58+00:00,"$200 million to secure Townsville’s water future.  We’re backing Queenslanders and there’s more to come. I’m listening, I’m hearing and we’re getting on with it. See you on the road!  https://t.co/oSQb9ZAPIG",86,410,"$200 million to secure Townsville’s water future.  We’re backing Queenslanders and there’s more to come. I’m listening, I’m hearing and we’re getting on with it. See you on the road!  https://t.co/oSQb9ZAPIG "
1058932703209213953,2018-11-04 04:03:25+00:00,"Looking forward to hitting the road in Qld this week and keeping Australia on the right track - lower taxes, more jobs, lower electricity prices, economy building and congestion busting infrastructure, AAA balanced budgets. https://t.co/TnRFVZFjbj",72,345,"Looking forward to hitting the road in Qld this week and keeping Australia on the right track - lower taxes, more jobs, lower electricity prices, economy building and congestion busting infrastructure, AAA balanced budgets. https://t.co/TnRFVZFjbj "
1058184448481538048,2018-11-02 02:30:07+00:00,"Love your work, mate. Had a good laugh! https://t.co/DbmmxECtco",130,674,"Love your work, mate. Had a good laugh! https://t.co/DbmmxECtco "
1057586886888194048,2018-10-31 10:55:37+00:00,"[1/2] First win for #PMsXI today in five years taking on the Proteas. Well done, guys. Especially, @joshphilippe2 with 57 runs off 53 balls and 3 catches and 1 stumping behind the wickets.",15,123,"[1/2] First win for #PMsXI today in five years taking on the Proteas. Well done, guys. Especially, @joshphilippe2 with 57 runs off 53 balls and 3 catches and 1 stumping behind the wickets. "
1057585085543735297,2018-10-31 10:48:28+00:00,[2/2] @JDorff5 was 3 for 35 off 7 overs.  Usman Qadir was 3 for 28 off 10 overs and skipper George Bailey brought the team home with a boundary and 51 not out off 76 balls.  #PMsXI #cricket,12,94,[2/2] @JDorff5 was 3 for 35 off 7 overs.  Usman Qadir was 3 for 28 off 10 overs and skipper George Bailey brought the team home with a boundary and 51 not out off 76 balls.  #PMsXI #cricket 
1057496130152513538,2018-10-31 04:54:59+00:00,ICYMI: Here's what our Government is doing to honour our nation's veterans. https://t.co/GnrZ02NQCi,66,296,ICYMI: Here's what our Government is doing to honour our nation's veterans. https://t.co/GnrZ02NQCi 
1057424010114347008,2018-10-31 00:08:24+00:00,"[2/2] This is the problem with Labor, obsessed with nonsense like removing gender from birth certificates rather than lower electricity prices, reducing tax for hard-working families and small businesses.",234,1197,"[2/2] This is the problem with Labor, obsessed with nonsense like removing gender from birth certificates rather than lower electricity prices, reducing tax for hard-working families and small businesses. "
1057423920830144513,2018-10-31 00:08:03+00:00,"[1/2] A Liberal National Government will never remove gender from birth certificates, licenses and passports – who are Labor kidding? Get real.   https://t.co/CLk70qL3rI",179,643,"[1/2] A Liberal National Government will never remove gender from birth certificates, licenses and passports – who are Labor kidding? Get real.   https://t.co/CLk70qL3rI "
1057110966062604288,2018-10-30 03:24:29+00:00,Meet Mick and Kris from @onthegolife and hear what they've got to say about how our Government is supporting them. https://t.co/cvx1C3FOv0,19,71,Meet Mick and Kris from @onthegolife and hear what they've got to say about how our Government is supporting them. https://t.co/cvx1C3FOv0 
1056787143878561792,2018-10-29 05:57:43+00:00,More investment. More tourism. More jobs. Our Geelong City Deal will be a game changer. https://t.co/BCSX4kiGR5,51,244,More investment. More tourism. More jobs. Our Geelong City Deal will be a game changer. https://t.co/BCSX4kiGR5 
1056736668751880192,2018-10-29 02:37:09+00:00,".@samkerr1, I’m #Onside! Supporting the bid for 2023 and female football across Australia ⚽️ https://t.co/KDRvCe1EGS",49,369,".@samkerr1, I’m #Onside! Supporting the bid for 2023 and female football across Australia ⚽️ https://t.co/KDRvCe1EGS "
1056648713542676480,2018-10-28 20:47:39+00:00,A win for common sense. We should always be proud to celebrate Australia Day.  https://t.co/EMpTQAAQNq,111,688,A win for common sense. We should always be proud to celebrate Australia Day.  https://t.co/EMpTQAAQNq 
1056292986932187136,2018-10-27 21:14:07+00:00,The evil shooting of innocent Americans gathering together in faith in their Synagogue in Pittsburgh is truly awful. We send our love to their families and their community and to our own Jewish community here in Australia as they hear this terrible news.,125,666,The evil shooting of innocent Americans gathering together in faith in their Synagogue in Pittsburgh is truly awful. We send our love to their families and their community and to our own Jewish community here in Australia as they hear this terrible news. 
1056039938242703361,2018-10-27 04:28:36+00:00,"Not one cent of funds for the NDIS is being used to support our new Future Drought Fund. The NDIS is 100% fully funded. Every cent, every dollar.",139,428,"Not one cent of funds for the NDIS is being used to support our new Future Drought Fund. The NDIS is 100% fully funded. Every cent, every dollar. "
1056009224616996864,2018-10-27 02:26:33+00:00,"As #InvictusGames2018 comes to a close, our Government is acknowledging and recognising the service of our veterans. https://t.co/huhI2xsEZq",85,579,"As #InvictusGames2018 comes to a close, our Government is acknowledging and recognising the service of our veterans. https://t.co/huhI2xsEZq "
1055717631720734720,2018-10-26 07:07:52+00:00,"Since the day I became Prime Minister, my number one priority has been dealing with this awful drought.  We can't make it rain, but these are some of the things we can do together.  #DroughtSummit https://t.co/kQ1P3REkZp",85,402,"Since the day I became Prime Minister, my number one priority has been dealing with this awful drought.  We can't make it rain, but these are some of the things we can do together.  #DroughtSummit https://t.co/kQ1P3REkZp "
1055633213899464705,2018-10-26 01:32:25+00:00,I've heard @RaySmith_Bland's message from Bland Shire Council: https://t.co/uGUi6BDfR6 And I've got a message for them.  #BringFlavourToBland #DroughtSummit https://t.co/5WsHU4U2zc,29,121,I've heard @RaySmith_Bland's message from Bland Shire Council: https://t.co/uGUi6BDfR6 And I've got a message for them.  #BringFlavourToBland #DroughtSummit https://t.co/5WsHU4U2zc 
1054608586125402113,2018-10-23 05:40:55+00:00,You asked about how we're getting electricity prices down. Here's my answer. https://t.co/LFrxFLcLpR,169,718,You asked about how we're getting electricity prices down. Here's my answer. https://t.co/LFrxFLcLpR 
1054238309914791936,2018-10-22 05:09:34+00:00,"Today, we say we are sorry. Sorry that you were not protected, that you were not listened to, for refusing to trust the words of children, for not believing you. As we say sorry, we also say we believe you. We say what happened was not your fault. https://t.co/E71fjm69eg",255,828,"Today, we say we are sorry. Sorry that you were not protected, that you were not listened to, for refusing to trust the words of children, for not believing you. As we say sorry, we also say we believe you. We say what happened was not your fault. https://t.co/E71fjm69eg "
1052775871491100672,2018-10-18 04:18:22+00:00,The things that matter. https://t.co/OoKGJ0Zwx4,217,1035,The things that matter. https://t.co/OoKGJ0Zwx4 
1052757675581140992,2018-10-18 03:06:03+00:00,"There must be something wonderful in the water at Goolwa… Mr and Mrs Collings are an inspiration to every married couple in our country.  On behalf of the Government and the country, I want to wish them a happy 80th wedding anniversary tomorrow. https://t.co/PpcupDUUex",51,343,"There must be something wonderful in the water at Goolwa… Mr and Mrs Collings are an inspiration to every married couple in our country.  On behalf of the Government and the country, I want to wish them a happy 80th wedding anniversary tomorrow. https://t.co/PpcupDUUex "
1052728512673509376,2018-10-18 01:10:10+00:00,"Tax cuts for small and family businesses have passed the parliament and unemployment has fallen to 5%, the lowest level in seven years. Our Government’s plans are working.",146,574,"Tax cuts for small and family businesses have passed the parliament and unemployment has fallen to 5%, the lowest level in seven years. Our Government’s plans are working. "
