,id,created_at,text,rt_count,fav_count,english,cleaned_text,zeroshot_sentiment,vader_sentiment,blob_sentiment
511,1334556306070523906,2020-12-03 17:53:12+00:00,Notre troisième objectif est de construire une logistique adaptée au défi majeur qui s'ouvre. Acheminer des millions de vaccins est une opération d’une très grande complexité. → Nous serons prêts pour les premières vaccinations à partir de début janvier.,59,206,Our third goal is to build logistics adapted to the major challenge that opens. Transmitting millions of vaccines is an operation of very great complexity. → We will be ready for the first vaccinations from the beginning of January. ,third goal build logistic adapt major challenge open transmit million vaccine operation great complexity ready first vaccination begin january,NEGATIVE,POSITIVE,POSITIVE
512,1334553595090526213,2020-12-03 17:42:26+00:00,Notre deuxième objectif est de vacciner en priorité les personnes pour lesquelles le virus est la plus dangereux. C’est un impératif de santé publique. → La Haute autorité de Santé a établi un ordre très précis des populations à vacciner. https://t.co/hIBCv2ussC,50,158,Our second goal is to first vaccinate people for whom the virus is the most dangerous. It is a public health imperative. → The high health authority has established a very precise order of populations to vaccinate. https://t.co/hibcv2ussc ,second goal first vaccinate people virus dangerous public health imperative high health authority establish precise order population vaccinate,NEGATIVE,NEGATIVE,POSITIVE
513,1334551436949155840,2020-12-03 17:33:51+00:00,La vaccination sera gratuite pour tous.,752,5403,Vaccination will be free for all. ,vaccination free,POSITIVE,POSITIVE,POSITIVE
514,1334550647862079491,2020-12-03 17:30:43+00:00,Notre premier objectif a été de garantir que la France aura suffisamment de vaccins le moment venu. → La France disposera d’un potentiel de 200 millions de doses ce qui permettrait de vacciner 100 millions de personnes puisque le vaccin nécessite à ce jour 2 injections. https://t.co/LQrHrZgmhM,69,193,Our first objective was to guarantee that France will have enough vaccines when it comes. → France will have a potential of 200 million doses which would vaccinate 100 million people since the vaccine requires 2 injections so far. https://t.co/lqrhrzgmhm ,first objective guarantee france enough vaccine come france potential million dose would vaccinate million people since vaccine require injection far,NEUTRAL,POSITIVE,POSITIVE
515,1334544549134348288,2020-12-03 17:06:29+00:00,"La France est aujourd’hui le pays d’Europe où la baisse de la pression épidémique a été la plus forte et la plus rapide.  C’est le fruit des efforts de chacune et chacun. C’est aussi le résultat de notre stratégie de freinage, avec le couvre-feu d’abord, puis le confinement.",134,676,"France is today the country of Europe where the decline in epidemic pressure has been the strongest and fastest. This is the fruit of everyone's efforts. It is also the result of our braking strategy, with the curfew first, then the confinement. ",france today country europe decline epidemic pressure strong fast fruit everyone effort also result brake strategy curfew first confinement,NEGATIVE,POSITIVE,POSITIVE
516,1334534307810045954,2020-12-03 16:25:48+00:00,L'arrivée de vaccins est une étape majeure dans notre combat contre la #COVID19. Elle suscite aussi chez les Français des questions légitimes et nombreuses. Je présenterai à 18h00 la stratégie du Gouvernement. https://t.co/5DsfyOGLS1,89,204,The arrival of vaccines is a major step in our fight against # Covid19. It also arouses with the French legitimate and numerous questions. I will present at 18:00 the government's strategy. https://t.co/5dsfyogls1 ,arrival vaccine major step fight also arouse french legitimate numerous question present government strategy,NEGATIVE,NEGATIVE,POSITIVE
517,1334515479990439942,2020-12-03 15:10:59+00:00,"Avenir des pêcheurs, contrôles douaniers et sanitaires, sécurité de la frontière franco-britannique : quelle que soit l'issue des négociations entre l'UE et le Royaume-Uni, l'État est prêt et accompagnera l'ensemble des acteurs de terrain. Le Brexit ne doit faire aucun perdant. https://t.co/tCnIKF8GvE",40,171,"Fake Fishermen, Customs and Health Controls, Franco-British border security: Whatever the outcome of the negotiations between the EU and the United Kingdom, the state is ready and will accompany all the actors of the field. Brexit should not make any losers. https://t.co/tcnikf8gve ",fake fisherman custom health control franco british border security whatever outcome negotiation eu united kingdom state ready accompany actor field brexit not make loser,NEGATIVE,POSITIVE,NEGATIVE
518,1334410359634096128,2020-12-03 08:13:16+00:00,"Valéry Giscard d'Estaing avait la France pour passion et l'Europe pour horizon. Homme de progrès et de liberté, c'est l'audace de son projet et le courage de ses réformes qui firent de la France une nation plus forte, une démocratie plus moderne et une société plus solidaire.",110,724,"Valery Giscard d'Estaing had France for Passion and Europe for horizon. Man of progress and freedom is the audacity of his project and the courage of his reforms that made France a stronger nation, a more modern democracy and a more solidarity society. ",valery giscard destae france passion europe horizon man progress freedom audacity project courage reform make france strong nation modern democracy solidarity society,POSITIVE,POSITIVE,POSITIVE
519,1334069658064982016,2020-12-02 09:39:26+00:00,"Nous expérimenterons dans les prochaines semaines dans 3 territoires des campagnes de dépistage massif de la #COVID19. Objectif : mieux connaître le virus, mieux identifier les lieux de contamination, les populations les plus à risque et ainsi prévenir la reprise de l'épidémie. https://t.co/KJ4rD5WvPu",69,237,"We will experiment in the coming weeks in 3 territories of massive screening campaigns of # COVID19. Objective: To better understand the virus, better identify the places of contamination, the most at risk populations and thus prevent the resumption of the epidemic. https://t.co/kj4rd5wvpu ",experiment come week territory massive screening campaign objective well understand virus well identify place contamination risk population thus prevent resumption epidemic,NEGATIVE,POSITIVE,NEUTRAL
520,1334057038566076417,2020-12-02 08:49:18+00:00,"Là où l'activité avait chuté de 30% au premier confinement, elle a diminué d'environ 10% sur ces dernières semaines. Cet équilibre entre la santé des Français, priorité absolue, et l'indispensable sauvegarde de notre économie, nous essayons tous les jours de l'atteindre.",71,438,"Where the activity had dropped by 30% to the first confinement, it decreased by about 10% in recent weeks. This balance between the health of the French, absolute priority, and the indispensable safeguarding our economy, we try every day to reach it. ",activity drop first confinement decrease recent week balance health french absolute priority indispensable safeguarding economy try every day reach,NEGATIVE,NEUTRAL,POSITIVE
521,1334054824762073091,2020-12-02 08:40:30+00:00,"L'épidémie a reculé. Son rythme de régression nous place même, en Europe, dans les pays où la situation est la moins préoccupante. Nous le devons aux efforts des Français et aux décisions difficiles mais nécessaires que nous avons prises. https://t.co/ylq6ciliOo",71,298,"The epidemic declined. Its rhythm of regression even places us, in Europe, in countries where the situation is the least worrying. We owe it to the efforts of the French and the difficult decisions that we have taken. https://t.co/ylq6ciloo ",epidemic decline rhythm regression even place us europe country situation least worry owe effort french difficult decision take,NEGATIVE,NEUTRAL,NEGATIVE
522,1334051186459123712,2020-12-02 08:26:02+00:00,"Nos policiers et gendarmes nous protègent au péril de leur vie : quatre d'entre eux sont décédés, en service, depuis mon arrivée à Matignon. Je leur apporte un soutien total mais nous devons aussi être intraitables sur le respect des lois de la République et de la déontologie. https://t.co/iTyNGRUUkH",93,366,"Our police and gendarmes protect us at the risk of their lives: four of them died, in service, since my arrival in Matignon. I bring them total support but we must also be intractable on the respect of the laws of the republic and ethics. https://t.co/ityyngruukh ",police gendarme protect we risk live four die service since arrival matignon bring total support must also intractable respect law republic ethic,NEUTRAL,POSITIVE,POSITIVE
523,1334045667518537729,2020-12-02 08:04:07+00:00,"Notre intention était claire : protéger nos forces de sécurité mais en aucun cas de porter atteinte à la liberté d'informer. Malgré les clarifications apportées, l'ambiguïté n'a pas été levée : l'article 24 sera retravaillé et le Parlement ira au bout de ses prérogatives. https://t.co/iuhhZa2TkJ",57,229,"Our intention was clear: protect our security forces but in no way undermine the freedom to inform. Despite the clarifications brought, the ambiguity was not lifted: Article 24 will be reworked and the Parliament will leave at the end of its prerogatives. https://t.co/iuhhza2tkj ",intention clear protect security force no way undermine freedom inform despite clarification bring ambiguity not lift article rework parliament leave end prerogative,NEUTRAL,POSITIVE,POSITIVE
524,1333822249003081729,2020-12-01 17:16:20+00:00,"Longtemps taboue, parfois sous-estimée, la question du suicide chez les agriculteurs ne pouvait rester sans réponse. Les travaux d'Olivier Damaisin nous permettront d'agir aux racines du mal-être paysan, tout en accompagnant davantage le monde agricole avec @J_Denormandie. https://t.co/Ghk4rm4vak",78,329,"Long taboo, sometimes underestimated, the subject of suicide among farmers could not remain unanswered. The work of Olivier Damaisin will allow us to act at the roots of the peasant malaise, while accompanying the agricultural world more with @J_denormandie. https://t.co/ghk4rm4vak ",long taboo sometimes underestimate subject suicide among farmer could not remain unanswered work olivi damaisin allow we act root peasant malaise accompany agricultural world,NEGATIVE,NEGATIVE,NEGATIVE
525,1333805207994707970,2020-12-01 16:08:37+00:00,Nous assumons totalement notre objectif de protéger les forces de sécurité intérieure mais nous entendons les interrogations autour de la liberté d’expression et de la liberté de la presse auxquelles nous sommes profondément attachés. Toute ambiguïté sera levée. https://t.co/IjwjkBSpVJ,41,156,We totally assume our goal of protecting the inner security forces but we hear questions about freedom of expression and freedom of the press to which we are deeply attached. Any ambiguity will be lifted. https://t.co/ijwjkbspvj ,totally assume goal protect inner security force hear question freedom expression freedom press deeply attach ambiguity lift,NEUTRAL,POSITIVE,NEUTRAL
526,1333803403806265345,2020-12-01 16:01:26+00:00,"La sécurité des Français est une priorité absolue. Avec la proposition de loi d'@AliceThourot et Jean-Michel Fauvergue, nous passons des discours aux actes : elle renforcera l'action des polices municipales, encadrera la sécurité privée et protégera mieux ceux qui nous protègent. https://t.co/3FaX7QVUlI",41,171,"The safety of the French is an absolute priority. With the law of law of @ Alicethourot and Jean-Michel Fauvergue, we pass speeches to acts: it will strengthen the action of municipal policies, will supervise private security and better protect those who protect us. https://t.co/3fax7qvuli ",safety french absolute priority law law alicethourot jean michel fauvergue pass speech act strengthen action municipal policy supervise private security well protect protect we,NEUTRAL,POSITIVE,POSITIVE
527,1333468986865045507,2020-11-30 17:52:35+00:00,"Le plan #1jeune1solution, les primes à l'embauche, ce n'est pas un « cadeau » fait aux entreprises : c'est permettre à nos jeunes de s'insérer sur le marché de l'emploi dans une période particulièrement difficile. Et ça marche ! → https://t.co/YSKkS7N6kn https://t.co/y23vTikZVl",73,202,"The plan # 1jeune1Solution, premiums for hiring, it is not a ""gift"" made to companies: it allows our young people to fit into the job market in a particularly difficult period. And it works ! → https://t.co/yskks7n6kn https://t.co/y23vtikzvl ",plan premium hire not gift make company allow young people fit job market particularly difficult period work,NEGATIVE,NEGATIVE,NEUTRAL
528,1333455953639993350,2020-11-30 17:00:48+00:00,"Historique ! Comme Alexis et Dounia, recrutés par l'entreprise KONE, à Trappes, près de 400 000 jeunes auront signé un contrat d'apprentissage à la fin de l'année. Malgré la crise, notre pays n'aura jamais formé autant d'apprentis en 2020. C'est une fierté et une chance ! https://t.co/jCPb0PTtab",81,393,"History! As Alexis and Dounia, recruited by Kone, to Trappes, nearly 400,000 young people will have signed a learning contract at the end of the year. Despite the crisis, our country will never have formed so many apprentices in 2020. It's a pride and a chance! https://t.co/jcpb0pttab ",history alexis dounia recruit kone trappe nearly young people sign learn contract end year despite crisis country never form many apprentice pride chance,NEGATIVE,POSITIVE,POSITIVE
529,1332699790329655298,2020-11-28 14:56:05+00:00,10 millions de téléchargements : plus d'un Français sur six a déjà installé #TousAntiCovid ! C'est un maillon essentiel de notre stratégie pour nous protéger et protéger nos proches. Si vous ne l'avez pas encore sur votre smartphone ↴ https://t.co/PI3O9Abk3W https://t.co/Fn0iX9oRR7,123,397,10 million downloads: more than one in six French has already installed #tousanticovid! It is an essential link in our strategy to protect us and protect our loved ones. If you do not have it yet on your smartphone ↴ https://t.co/pi3o9abk3w https://t.co/fn0ix9orr7 ,million download one six french already instal essential link strategy protect we protect love one not yet smartphone,POSITIVE,POSITIVE,POSITIVE
530,1332686249820295174,2020-11-28 14:02:16+00:00,"Je ne signe pas de mots d’absence...mais je continuerai à me battre pour que nos lycéens puissent poursuivre leur scolarité dans les meilleures conditions. Plus qu’un choix, c’est notre devoir ! https://t.co/LCtHW77Wf9",79,543,"I do not sign any words of absence ... But I will continue to fight for our high school students to continue their schooling in the best conditions. More than a choice, it's our duty! https://t.co/lcthw77wf9 ",not sign word absence continue fight high school student continue school good condition choice duty,NEGATIVE,POSITIVE,POSITIVE
531,1332671448419348480,2020-11-28 13:03:27+00:00,"Soulagement, bonheur de retrouver ses clients et de vivre de son activité à l’approche de Noël : ces mots sont revenus dans chacun de nos échanges avec les commerçants de Reims. Comme partout en France, ils vous attendent dès aujourd’hui : soutenons nos commerces de proximité ! https://t.co/AGP43sHPIm",62,424,"Relief, happiness to find its customers and live from its activity as Christmas approach: these words returned to each of our exchanges with the traders of Reims. As everywhere in France, they are waiting for you today: support our local shops! https://t.co/agp43shpim ",relief happiness find customer live activity christmas approach word return exchange trader reim everywhere france wait today support local shop,POSITIVE,POSITIVE,POSITIVE
532,1332314585710419969,2020-11-27 13:25:25+00:00,"Accompagner, faciliter les démarches de chacun et finalement apporter à chaque problème une solution concrète, de l’aide et une écoute : plus que jamais, l’action admirable des agents des caisses d’allocations familiales est nécessaire et précieuse. https://t.co/rpKCPzyAAx",52,265,"Accompanying, facilitating everyone's approaches and finally bring to each problem a concrete solution, help and listening: more than ever, the admirable action of family allowance crates agents is necessary and valuable. https://t.co/rpkcpzyaax ",accompany facilitating everyone approach finally bring problem concrete solution help listen ever admirable action family allowance crate agent necessary valuable,POSITIVE,POSITIVE,POSITIVE
533,1332262701930848260,2020-11-27 09:59:15+00:00,"Lorsqu’on peine à boucler ses fins de mois, aux paroles, on préfère souvent les actes. Conformément à l’engagement d’@EmmanuelMacron les CAF et CROUS verseront à partir de ce jour : ➖ 150€ + 100€/enfant à 4 millions de foyers précaires ➖ 150€ à 1,3 million de jeunes.",183,712,"When it is difficult to complete its ends of months, the lyrics, it is often preferred. In accordance with the commitment of @ Emmanuelmacron The Caf and CROUS will pay from this day: ➖ 150 € + 100 € / child to 4 million precarious homes ➖ 150 € to 1.3 million young people. ",difficult complete end month lyric often prefer accordance commitment emmanuelmacron caf crous pay day child million precarious home million young people,NEGATIVE,NEGATIVE,NEGATIVE
534,1331933786205007872,2020-11-26 12:12:15+00:00,"Saisonniers, intermittents, travailleurs en « extra » alternant chômage et contrats courts dans des secteurs sinistrés : nous vous assurerons à partir du premier novembre une garantie de ressources de 900 euros par mois jusqu’en février 2021. https://t.co/WnfaaKULvo",59,149,"Seasonal, intermittent, ""extra"" workers alternating unemployment and short contracts in affected areas: We will ensure the first November a guarantee of 900 euros per month until February 2021. https://t.co/ Wnfaakulvo ",seasonal intermittent extra worker alternate unemployment short contract affect area ensure first november guarantee euro per month february wnfaakulvo,NEGATIVE,POSITIVE,POSITIVE
535,1331931744136802307,2020-11-26 12:04:08+00:00,Nous allons répondre à la situation des entreprises qui ne sont pas administrativement fermées mais dont l’activité est directement impactée. → Le fonds de solidarité rénové pourra les indemniser à hauteur de 15 % à 20% du chiffre d'affaires mensuel réalisé en 2019. https://t.co/f137QhlWDE,43,131,We will respond to the situation of companies that are not administratively closed but whose activity is directly impacted. → The renovated solidarity fund will be able to compensate them up to 15% to 20% of the monthly turnover achieved in 2019. https://t.co/f137qhlwde ,respond situation company not administratively close whose activity directly impact renovate solidarity fund able compensate monthly turnover achieve,NEGATIVE,POSITIVE,POSITIVE
536,1331922720376950784,2020-11-26 11:28:17+00:00,"Les bars et les restaurants resteront fermés, jusqu’au 20 janvier. Il s’agit d’une décision extrêmement difficile à prendre. Mais elle est nécessaire et je m'en explique ↴ https://t.co/YacIDnxd45",96,284,Bars and restaurants will stay closed until January 20th. This is an extremely difficult decision to take. But it is necessary and I explain myself ↴ https://t.co/yacidnxd45 ,bar restaurant stay closed january extremely difficult decision take necessary explain,NEGATIVE,NEGATIVE,NEGATIVE
537,1331911992014229509,2020-11-26 10:45:39+00:00,"Compte tenu de l’évolution positive de la situation sanitaire et des échanges fructueux qui ont eu lieu avec les professionnels durant ces dernières semaines, les commerces qui étaient jusque-là fermés, quelle que soit leur taille, pourront rouvrir samedi 28 novembre. https://t.co/bzOEZ8OKHm",46,123,"Given the positive evolution of the health situation and fruitful exchanges that have occurred with professionals in recent weeks, businesses that were so far closed, regardless of their size, will be able to reopen Saturday, November 28. https://t.co/bzoez8okhm ",give positive evolution health situation fruitful exchange occur professional recent week business far close regardless size able reopen saturday november,POSITIVE,POSITIVE,POSITIVE
538,1331909587570749445,2020-11-26 10:36:06+00:00,Il est prématuré de parler de déconfinement. https://t.co/WNb6L0xQXS,77,244,It is premature to talk about deconformation. https://t.co/wnb6l0xqxs ,premature talk deconformation,NEGATIVE,NEUTRAL,NEUTRAL
539,1331903568849342464,2020-11-26 10:12:11+00:00,"Nous devons avancer par étape et donner de la visibilité. Mais nous ne pourrons franchir chacune de ces étapes que si la situation épidémique nous le permet, si l’évolution favorable que nous observons se poursuit, si la pression sur nos services hospitaliers se réduit. https://t.co/EpFf7zH98M",275,613,"We need to move forward in step and give visibility. But we will not be able to cross each of these steps that if the epidemic situation allows us, if the favorable evolution we observe continues, if the pressure on our hospital services is reduced. https://t.co/epff7zh98m ",need move forward step give visibility not able cross step epidemic situation allow we favorable evolution observe continue pressure hospital service reduce,NEGATIVE,POSITIVE,NEGATIVE
540,1331902194384252929,2020-11-26 10:06:43+00:00,"Les mesures de freinage que nous avons prises ont permis de ralentir nettement la circulation du virus. Alors que nous comptions près de 45 000 nouveaux cas par jour début novembre, nous sommes redescendus, en moyenne sur les 7 derniers jours, à 17 000 cas par jour. https://t.co/G9ULdfeAym",95,291,"The braking measures we have taken have significantly slowed the circulation of the virus. While we comply with nearly 45,000 new cases a day in early November, we went down, on average over the last 7 days, at 17,000 cases a day. https://t.co/g9uldfeaym ",brake measure take significantly slow circulation virus comply nearly new case day early november go average last day case day,NEGATIVE,NEUTRAL,NEGATIVE
541,1331677142183272463,2020-11-25 19:12:26+00:00,Vous pouvez d'ores et déjà me poser vos questions et me faire part de vos interrogations sur mon compte Instagram. J'y répondrai demain à l'issue de la conférence de presse. → https://t.co/Xvr3irzL2x https://t.co/uzeM2fdQRF https://t.co/3zOJwlULuU,51,135,You can already ask my questions and tell me about your questions about my Instagram account. I will answer tomorrow at the end of the press conference. → https://t.co/xvr3irzl2x https://t.co/uzem2fdqrf https://t.co/3zojwluluu ,already ask question tell question instagram account answer tomorrow end press conference,NEUTRAL,NEUTRAL,NEUTRAL
542,1331665822704693249,2020-11-25 18:27:27+00:00,#COVID19 | Je ferai le point demain matin sur la situation sanitaire et l'assouplissement des mesures de confinement.  Conférence de presse à suivre en direct sur :  ➖ Facebook : https://t.co/ftAE8RdmFb ➖ Twitter : @GouvernementFR. https://t.co/ExGiM0Di04,110,361,# COVID19 | I will take stock tomorrow morning on the sanitary situation and the relaxation of confinement measures. Press conference to follow live on: ➖ Facebook: https://t.co/ftae8rdmfb ➖ twitter: @Government. https://t.co/exgim0di04 ,take stock tomorrow morning sanitary situation relaxation confinement measure press conference follow live facebook twitter,NEGATIVE,POSITIVE,POSITIVE
543,1331493202050904065,2020-11-25 07:01:31+00:00,"#NeRienLaisserPasser | Vous êtes victime ou témoin de violences faites aux femmes ?   En cas de danger, appelez le 17 ou envoyez un SMS au 114  Pour un conseil, faites le 3919 (anonyme &amp; gratuit)  Pour faire un signalement anonyme, rendez-vous sur https://t.co/NL3LS6wIac https://t.co/0saBVAlVZm",211,355,"#NEENIENLANDEPASS | You are a victim or witness to violence against women? In case of danger, call 17 or send an SMS to 114 for advice, do 3919 (anonymous & free) to make an anonymous report, visit https://t.co/nl3ls6wiac https: // T.CO/0SABVALVZM ",victim witness violence woman case danger call send sm advice anonymous free make anonymous report visit co,NEGATIVE,NEGATIVE,POSITIVE
544,1331251838847475713,2020-11-24 15:02:26+00:00,"À l'issue du processus législatif qui permettra, j'en suis sûr, d'améliorer, de clarifier et d'enrichir la proposition de loi relative à la sécurité globale, je saisirai le Conseil constitutionnel sur son article 24.",73,341,"At the end of the legislative process, I am sure, to improve, to clarify and enrich the proposed law on global security, I will grab the Constitutional Council on its article 24. ",end legislative process sure improve clarify enrich propose law global security grab constitutional council article,NEGATIVE,POSITIVE,POSITIVE
545,1331249493027803143,2020-11-24 14:53:07+00:00,"Il n'a jamais été, il n'est pas, et il ne sera jamais dans les intentions du Gouvernement de porter atteinte, de quelque manière que ce soit, à la liberté de la presse, à la liberté d'expression et aux fondements de la loi de 1881. https://t.co/2jFDM9ogCD",68,233,"It has never been, it is not, and it will never be in the government's intentions to undermine, in any way, with the freedom of the press, freedom of expression and the foundations of the law of 1881. https://t.co/2jfdm9ogcd ",never not never government intention undermine way freedom press freedom expression foundation law,NEGATIVE,POSITIVE,NEUTRAL
