,id,created_at,text,rt_count,fav_count,english,cleaned_text,zeroshot_sentiment,vader_sentiment,blob_sentiment
0,1447310964387373056,2021-10-10 21:19:58+00:00,"C'est ainsi que s'écrit « remontada » en français ! La victoire du talent, du mental et de l'audace. Renversante équipe de France ! Bravo les bleus et merci. #FiersdetreBleus https://t.co/IJlLHfbhCo",142,1125,"This is how ""Remontada"" is written in French! The victory of talent, mental and audacity. Stunning France team! Bravo the blues and thank you. #FiersDrebleus https://t.co/ijllhfbhco ",remontada write french victory talent mental audacity stun france team bravo blue thank,POSITIVE,POSITIVE,NEGATIVE
1,1446523644323274766,2021-10-08 17:11:26+00:00,"C'est ici, à Poitiers, « capitale de l’éducation » qui rassemble le @cned, le @reseau_canope et @Ih2ef que je suis venu parler du numérique éducatif pour tous. Si la crise du #COVID19 a souligné nos atouts, elle a aussi révélé nos lacunes. Ensemble, nous allons y remédier : https://t.co/OavuofSv7V",81,223,"It is here in Poitiers, ""capital of education"" that brings together the @cned, the @reseau_canope and @ ih2ef that I came to talk about the digital educational for all. If the crisis of # COVID19 highlighted our assets, it also revealed our gaps. Together we will remedy it: https://t.co/oavuofsv7v ",poitier capital education bring together come talk digital educational crisis highlight asset also reveal gap together remedy,NEGATIVE,NEGATIVE,POSITIVE
2,1445755216591134730,2021-10-06 14:17:59+00:00,"900 millions € : jamais une telle somme n'avait été débloquée par l'État pour investir dans les transports collectifs en site propre. Derrière ce chiffre, du concret : 25 nouvelles lignes de tramway et 852 kilomètres de lignes de bus à haut niveau de service, partout en France. https://t.co/KR0EGKgPT1",113,376,"€ 900 million: Never was such a sum unlocked by the state to invest in public transport in own site. Behind this figure, concrete: 25 new tram lines and 852 kilometers of high-level bus lines, everywhere in France. https://t.co/kr0egkgt1 ",million never sum unlocked state invest public transport site behind figure concrete new tram line kilometer high level bus line everywhere france,NEUTRAL,NEUTRAL,POSITIVE
3,1445052320123965449,2021-10-04 15:44:55+00:00,Que nos agriculteurs puissent vivre dignement du fruit de leur travail : tel était l'objectif de cette proposition de loi. Je salue l'engagement des parlementaires et de @J_Denormandie qui ont travaillé main dans la main pour mieux rémunérer celles et ceux qui nous nourrissent. https://t.co/SThpOmXm4E,97,273,That our farmers can live with dignity of the fruit of their work: this was the objective of this bill. I welcome the commitment of parliamentarians and @J_denormandie who worked hand in hand to better pay those who nourish us. https://t.co/sthpomxm4e ,farmer live dignity fruit work objective bill welcome commitment parliamentarian work hand hand well pay nourish we,POSITIVE,POSITIVE,POSITIVE
4,1444219672459624449,2021-10-02 08:36:16+00:00,"Un an après la tempête Alex, je sais l'émotion des habitants de nos vallées. À tous ceux qui ont perdu un proche ou dont le quotidien a été bouleversé par cette épreuve, je veux redire le soutien de l'État. Aujourd'hui comme demain, il restera à leurs côtés. C'est son devoir. https://t.co/NSBEcjoxi4",70,285,"A year after the Storm Alex, I know the emotion of the inhabitants of our valleys. To all those who lost a loved one or whose daily lives has been upset by this test, I want to repeat the support of the state. Today as well tomorrow, he will stay at their side. It's his duty. https://t.co/nsbecjoxi4 ",year storm alex know emotion inhabitant valley lose love one whose daily live upset test want repeat support state today well tomorrow stay side duty,NEGATIVE,POSITIVE,POSITIVE
5,1443962278546706435,2021-10-01 15:33:29+00:00,Je revendique d'être le Premier ministre de l'Intendance. https://t.co/bmy25CnIu2,126,599,I claim to be the Prime Minister of Stewardship. https://t.co/bmy25cniu2 ,claim prime minister stewardship,NEUTRAL,NEUTRAL,NEUTRAL
6,1443926923143532544,2021-10-01 13:12:59+00:00,La sécurité est l'affaire de tous.  C'est en unissant nos forces et en mobilisant tous les acteurs que nous lutterons efficacement et durablement contre l'insécurité dans notre pays. C'est précisément l'objectif des contrats de sécurité intégrée : des moyens et une méthode. https://t.co/fFCqvbM2Ls,52,189,Security is everyone's business. It is by joining forces and mobilizing all the actors we will fight effectively and sustainably against insecurity in our country. This is precisely the objective of integrated security contracts: means and a method. https://t.co/ffcqvbm2ls ,security everyone business join force mobilize actor fight effectively sustainably insecurity country precisely objective integrated security contract mean method,POSITIVE,POSITIVE,POSITIVE
7,1443642201427349507,2021-09-30 18:21:37+00:00,La France s'est toujours battue au niveau européen pour maintenir des tarifs réglementés de vente de l'électricité. C'est ce qui va nous permettre d'éviter une hausse des tarifs d'ici la fin de l'année 2021. Elle sera limitée à 4% début 2022. https://t.co/F4bSs4nzid,180,449,France has always beaten at European level to maintain regulated tariffs for the sale of electricity. This will allow us to avoid a rise in tariffs by the end of the year 2021. It will be limited to 4% early 2022. https://t.co/f4bss4nzid ,france always beat european level maintain regulated tariff sale electricity allow we avoid rise tariff end year limit early,POSITIVE,NEGATIVE,POSITIVE
8,1443641561422647296,2021-09-30 18:19:04+00:00,"Nous mettons en place un bouclier tarifaire. Concrètement, pendant tout l'hiver prochain, le tarif du gaz ne dépassera jamais le niveau d'octobre 2021. La facture de chauffage des Français aurait dû augmenter de 30% : cela n'arrivera pas. https://t.co/AudXc6muU0",407,1081,"We set up a tariff shield. Concretely, throughout the next winter, the gas rate will never exceed October 2021. The heating invoice of the French should have increased by 30%: it will not happen. https://t.co/audxc6muu0 ",set tariff shield concretely throughout next winter gas rate never exceed october heating invoice french increase not happen,NEUTRAL,POSITIVE,POSITIVE
9,1443569229383405578,2021-09-30 13:31:39+00:00,"Avec les ostréiculteurs de l'étang de Thau, capitale méditerranéenne de l'élevage d'huîtres. Ces femmes et ces hommes sont aussi les sentinelles de cet écosystème lagunaire exceptionnel : leur savoir-faire est une chance et une fierté pour toute la région Occitanie. https://t.co/Wq6zpTamB1",52,217,"With the oyster farmers of the Thau pond, the Mediterranean capital of oyster breeding. These women and men are also the sentinels of this exceptional Lagunaire ecosystem: their know-how is a chance and pride for the entire Occitanie region. https://t.co/wq6zptamb1 ",oyster farmer thau pond mediterranean capital oyster breeding woman man also sentinel exceptional lagunaire ecosystem know chance pride entire occitanie region,POSITIVE,POSITIVE,POSITIVE
10,1443136424795070465,2021-09-29 08:51:50+00:00,La ruralité est une chance pour la France ! https://t.co/RJiXfAUzpC,81,339,Rurality is a chance for France! https://t.co/rjixfauzpc ,rurality chance france,NEUTRAL,POSITIVE,NEUTRAL
11,1442923632922038274,2021-09-28 18:46:16+00:00,Une leçon de courage et d'humanité mais aussi un message d'espoir pour le peuple afghan : la France partage les combats de Fawzia Koofi. Elle la soutiendra dans ses initiatives internationales. https://t.co/oq5C14Attt,58,257,A lesson of courage and humanity but also a message of hope for the Afghan people: France shares the fights of Fawzia Koofi. It will support it in its international initiatives. https://t.co/oq5c14aTTT ,lesson courage humanity also message hope afghan people france shares fight fawzia koofi support international initiative,POSITIVE,POSITIVE,NEUTRAL
12,1442836974449135621,2021-09-28 13:01:55+00:00,"Pour lever les obstacles qui freinent l’effort de construction de logements sociaux, nous nous sommes appuyés sur les propositions de la commission présidée par @frebsamen. Objectif : inciter les collectivités à délivrer des permis de construire dans les territoires tendus. https://t.co/YpFE5wNAae",59,169,"To remove the obstacles that hinder the effort to build social housing, we relied on the Commission's proposals chaired by @frebsamen. Objective: To encourage communities to deliver building permits in the stretched territories. https://t.co/yypfe5wnaae ",remove obstacle hinder effort build social housing rely commission proposal chair objective encourage community deliver building permit stretched territory,NEUTRAL,POSITIVE,NEGATIVE
13,1442577505488101382,2021-09-27 19:50:53+00:00,"Peu de gens savent l'énergie, l'abnégation, le talent, l'audace et finalement la passion qui ont permis ce soir à cette brigade de soulever ce trophée. Cette fierté, nous la partageons, en pensée avec monsieur Paul et tous ses héritiers. Ils sont la France, tout simplement. https://t.co/kjqZiH1pQ0",92,415,"Few people know energy, self-denial, talent, audacity and finally the passion that allowed this brigade tonight to lift this trophy. This pride, we share it, in thought with Mr. Paul and all his heirs. They are France, simply. https://t.co/kjqzih1pq0 ",people know energy self denial talent audacity finally passion allow brigade tonight lift trophy pride share think mr paul heirs france simply,POSITIVE,POSITIVE,NEUTRAL
14,1442548697666048001,2021-09-27 17:56:25+00:00,La France fait aujourd’hui le choix clair d’investir très fortement dans le capital humain. La formation des salariés et des demandeurs d’emploi est déterminante pour répondre non seulement aux besoins de court terme mais aussi pour accompagner les grandes transitions en cours. https://t.co/UePC8opK7R,91,306,France today makes the clear choice to invest very strongly in human capital. The training of employees and jobseekers is crucial to respond not only to the short-term needs but also to accompany the major transitions in progress. https://t.co/uepc8opk7r ,france today make clear choice invest strongly human capital training employee jobseeker crucial respond not short term need also accompany major transition progress,NEUTRAL,POSITIVE,POSITIVE
15,1442461633188618241,2021-09-27 12:10:27+00:00,Des demandeurs d'emploi qui ne retrouvent pas le chemin du travail et des secteurs qui peinent à recruter : c'est ce paradoxe - et ce gâchis ! - contre lequel nous nous donnons aujourd'hui les moyens de lutter. Nous allons agir sur 3 leviers.↴ https://t.co/cUxC1xbAck,144,455,Jobseekers who do not find the path of work and sectors that struggle to recruit: it's this paradox - and this mess! - against which we give ourselves today the means to fight. We will act on 3 levers.↴ https://t.co/cuxc1xback ,jobseeker not find path work sector struggle recruit paradox mess give today mean fight act lever,NEGATIVE,NEGATIVE,NEGATIVE
16,1442372318546776064,2021-09-27 06:15:33+00:00,Direction Châtellerault avec @Elisabeth_Borne. Nous y présenterons le plan du Gouvernement pour réduire les tensions de recrutement sur le marché du travail. Des mesures concrètes pour répondre dès maintenant aux attentes des demandeurs d'emploi et des entreprises. https://t.co/r99fHlu6FE,74,297,Direction Châtellerault with @elisabeth_borne. We will present the government plan to reduce recruitment tensions in the labor market. Concrete measures to meet the expectations of jobseekers and businesses. https://t.co/r99fhlu6fe ,direction ch tellerault present government plan reduce recruitment tension labor market concrete measure meet expectation jobseeker business,NEUTRAL,NEGATIVE,POSITIVE
17,1442175520867643395,2021-09-26 17:13:33+00:00,"La vie politique, c'est le collectif mais aussi l'équilibre. Pas un jour, l'énergie et la force de proposition du MoDem n'ont manqué à la majorité. Avec humilité mais aussi avec la fierté du chemin accompli ensemble, nous travaillerons jusqu'à la dernière seconde pour notre pays. https://t.co/s5u9535wzw",57,192,"Political life is the collective but also balance. Not a day, the energy and the force of proposal of the modem did not miss the majority. With humility but also with the pride of the accomplished path together, we will work until the last second for our country. https://t.co/s5u9535wzw ",political life collective also balance not day energy force proposal modem not miss majority humility also pride accomplished path together work last second country,POSITIVE,POSITIVE,POSITIVE
18,1442147745884672001,2021-09-26 15:23:11+00:00,Le maillot arc-en-ciel lui va si bien : héroïque Julian Alaphilippe ! Un immense champion qui a écrit aujourd'hui avec panache l'une des plus belles pages du sport tricolore. Bravo - et vive le cyclisme !,113,885,The rainbow jersey is going so well: Heroic Julian Alaphilippe! An immense champion who has written today with Panache one of the most beautiful pages of tricolor sports. Bravo - and long live cycling! ,rainbow jersey go well heroic julian alaphilippe immense champion write today panache one beautiful page tricolor sport bravo long live cycling,POSITIVE,POSITIVE,POSITIVE
19,1441796635160367106,2021-09-25 16:07:59+00:00,"L'Europe, il y a ceux qui n'ont qu'un seul projet : la combattre. Nous, nous avons fait le choix d'en débattre. Ici, à Toulouse, et partout en France. C'est ainsi que notre République entend répondre, sans caricatures, mais toujours avec lucidité aux enjeux de notre Union. https://t.co/2XBTCZPoY8",90,354,"Europe, there are those who have only one project: fighting it. We have chosen to debate it. Here, in Toulouse, and everywhere in France. This is how our Republic intends to answer, without caricatures, but always with lucidity to the stakes of our union. https://t.co/2xbtczpoy8 ",europe one project fight choose debate toulouse everywhere france republic intend answer without caricature always lucidity stake union,POSITIVE,NEGATIVE,NEUTRAL
20,1441457766804119555,2021-09-24 17:41:27+00:00,"93% des mesures présentées dans l'agenda rural ont été réalisées ou sont en cours de réalisation. #FranceRelance a par ailleurs investi plus de 8 milliards € dans des territoires ruraux. Dans l'Yonne, je suis venu accélérer et amplifier ce mouvement.↴ https://t.co/Doz2x40FsF",61,160,"93% of the measures presented in the rural agenda were carried out or are in progress. #Forseland has also invested more than € 8 billion in rural areas. In the Yonne, I came to accelerate and amplify this movement.↴ https://t.co/doz2x40fsf ",measure present rural agenda carry progress also invest billion rural area yonne come accelerate amplify movement,POSITIVE,POSITIVE,NEUTRAL
21,1441006512080670721,2021-09-23 11:48:19+00:00,L'@arsbfc va financer un pôle d'activités et de soins adaptés dans cet EHPAD d'Autun qui accueille des personnes atteintes de la maladie d'Alzheimer. Il leur proposera des activités sociales et thérapeutiques pour maintenir et réhabiliter leurs capacités fonctionnelles. https://t.co/elcBeyFG8K,48,145,"The @ ArsBFC will finance a pole of activities and care adapted in this EHPAD of Autun, which welcomes people with Alzheimer's disease. It will offer them social and therapeutic activities to maintain and rehabilitate their functional capabilities. https://t.co/elcbeyfg8k ",arsbfc finance pole activity care adapt ehpad autun welcome people alzheimer disease offer social therapeutic activity maintain rehabilitate functional capability,POSITIVE,POSITIVE,POSITIVE
22,1441003343145574400,2021-09-23 11:35:44+00:00,"C'est grâce à l'engagement de Maryline et des salariés des services à la personne que nos aînés peuvent rester à leur domicile. Ce défi, nous ne pourrons le relever qu'en revalorisant ces métiers essentiels alors que près de la moitié des structures peinent à recruter. https://t.co/8liiLTxTtK",61,204,"It is thanks to the commitment of Maryline and employees of the personal services that our elders can stay at home. This challenge, we will only be able to revalor these critical trades while almost half of the structures struggle to recruit. https://t.co/8liiltxttk ",thank commitment maryline employee personal service elder stay home challenge able revalor critical trade almost half structure struggle recruit,POSITIVE,POSITIVE,POSITIVE
23,1440268821403557888,2021-09-21 10:57:00+00:00,"Du concret. C'est grâce à l'insertion de publics éloignés de l'emploi que cette ancienne friche industrielle est devenue un pôle d'activité écologique et citoyenne au coeur de l'Île-Saint-Denis. Un cercle vertueux, une fierté pour ce territoire mais aussi un exemple à suivre. https://t.co/0Cc1586tAM",36,181,"Concrete. It is thanks to the insertion of public people away from the job that this former industrial wasteland has become a pole of ecological activity and citizen in the heart of Saint-Denis Island. A virtuous circle, a pride for this territory but also an example to follow. https://t.co/0CC1586tam ",concrete thank insertion public people away job former industrial wasteland become pole ecological activity citizen heart saint denis island virtuous circle pride territory also example follow,POSITIVE,POSITIVE,POSITIVE
24,1440255678669418497,2021-09-21 10:04:47+00:00,"La renationalisation du RSA : beaucoup l'ont évoquée, beaucoup l'ont promise. Aujourd'hui, nous le faisons. https://t.co/7zQ8Ihr2I0",146,338,"The renationalization of the RSA: many have mentioned it, many have promised it. Today, we do it. https://t.co/7zq8ihr2i0 ",renationalization rsa many mention many promise today,POSITIVE,POSITIVE,POSITIVE
25,1440214705738436617,2021-09-21 07:21:58+00:00,"Il y a 20 ans, l'explosion de l'usine AZF endeuillait la France et plongeait Toulouse dans l'effroi et la sidération. La Nation s'incline respectueusement en mémoire des victimes. Mes pensées accompagnent les Toulousains dont je sais l'émotion toujours vive et le souvenir intact.",134,527,"20 years ago, the explosion of the AZF factory began France and plunged Toulouse into fright and sidation. The nation respects respectfully in memory of the victims. My thoughts accompany the Toulouse that I know the emotion always lively and the memory intact. ",year ago explosion azf factory begin france plunge toulouse fright sidation nation respect respectfully memory victim thought accompany toulouse know emotion always lively memory intact,NEUTRAL,POSITIVE,POSITIVE
26,1439938853993914371,2021-09-20 13:05:50+00:00,"7ème étape du Train de la Relance, à Limoges. Partout en France, les équipes de #FranceRelance permettent à chacun de saisir les opportunités de ce plan dont nous avons veillé à ce qu'il n'oublie aucun territoire. → https://t.co/p9zwFeDtbp https://t.co/h9Dorxu89F",63,262,"7th stage of the raised train, in Limoges. Everywhere in France, #FranceRelance teams allow everyone to seize the opportunities of this plan we have made sure it does not forget any territory. → https://t.co/p9zwfedtbp https://t.co/h9dorxu89f ",stage raise train limoge everywhere france team allow everyone seize opportunity plan make sure not forget territory,POSITIVE,POSITIVE,POSITIVE
27,1439902544730468357,2021-09-20 10:41:33+00:00,"L'action publique est parfois affaire de symboles. Ici, à Bessines-sur-Gartempe, 20 ans après la fermeture de la dernière mine française d'uranium, @Oranogroup est resté le premier employeur industriel de la métallurgie dans le nord de la Haute-Vienne. https://t.co/WImqPjZ8jn",35,124,"Public action is sometimes dealing with symbols. Here in Bessins-sur-Gartempe, 20 years after the closure of the last French Mine of Uranium, @oranogroup remained the first industrial employer of metallurgy in northern Haute-Vienne. https://t.co/wimqpjz8jn ",public action sometimes deal symbol bessin sur gartempe year closure last french mine uranium remain first industrial employer metallurgy northern haute vienne,NEGATIVE,NEUTRAL,POSITIVE
28,1439635371382525955,2021-09-19 16:59:54+00:00,C'est la France ! https://t.co/cm0HUgYdgI,118,498,It's France ! https://t.co/cm0hugydgi ,france,NEUTRAL,NEUTRAL,NEUTRAL
29,1439270968019623940,2021-09-18 16:51:53+00:00,"C'est ici, au château de Saumur, immortalisé il y a plus de six siècles dans les Très Riches Heures du duc de Berry que j'ai souhaité débuter ces #JournéesDuPatrimoine : nous célébrons ensemble notre patrimoine, notre culture, notre identité commune mais aussi notre Histoire. https://t.co/SOGRZXuKH5",81,403,"It is here, at the Château de Saumur, immortalized more than six centuries in the very rich hours of the Duke de Berry that I wanted to start these #ingsDatrimoine: we celebrate our heritage, our culture, our common identity together but Also our story. https://t.co/sogrzxukh5 ",ch teau de saumur immortalize six century rich hour duke de berry want start celebrate heritage culture common identity together also story,POSITIVE,POSITIVE,POSITIVE
30,1438936123674406912,2021-09-17 18:41:20+00:00,"Réussir la transition écologique et améliorer le pouvoir d'achat des Français ne sont pas des objectifs contradictoires. Ils sont au contraire intimement liés. La preuve par le terrain, avec #MaPrimeRénov : https://t.co/nGThia6g0l",81,208,"Successful ecological transition and improve the purchasing power of the French are not contradictory objectives. They are on the contrary intimately linked. The proof in the field, with # Moteinov: https://t.co/ngthia6g0l ",successful ecological transition improve purchase power french not contradictory objective contrary intimately link proof field moteinov,NEUTRAL,POSITIVE,POSITIVE
31,1438541015133077507,2021-09-16 16:31:19+00:00,"#MaPrimeRénov est accessible à l'ensemble des logements collectifs. Dans cette copropriété de Chilly-Mazarin, elle va permettre un gain énergétique de 40% : des travaux bons pour la planète - et pour le porte-monnaie de ses habitants. https://t.co/pDEsghw5Yc",55,170,"# MINCHENOV is accessible to all collective dwellings. In this condominium of Chilly-Mazarin, it will allow an energy gain of 40%: good work for the planet - and for the wallet of its inhabitants. https://t.co/pdesghw5yc ",minchenov accessible collective dwelling condominium chilly mazarin allow energy gain good work planet wallet inhabitant,POSITIVE,POSITIVE,POSITIVE
32,1438504662693416966,2021-09-16 14:06:52+00:00,La hausse des prix de l'énergie affecte prioritairement les ménages les plus modestes. Une aide exceptionnelle de 100 € leur sera versée à la fin de l'année sous la forme d'un #ChèqueÉnergie. https://t.co/vcgQahg190,236,698,The rise in energy prices is primarily affecting the most modest households. Outstanding help from 100 € will be paid at the end of the year in the form of a # channel. https://t.co/vcgqahg190 ,rise energy price primarily affect modest household outstanding help pay end year form channel,NEGATIVE,POSITIVE,POSITIVE
33,1438502949219565572,2021-09-16 14:00:03+00:00,"Engagement tenu ! Pour la seule année 2021, 500 000 dossiers #MaPrimeRenov ont déjà été déposés. 500 000 rénovations efficaces, au service de la transition écologique et du pouvoir d'achat de nos concitoyens. https://t.co/tdB6CpV8bw https://t.co/qdqvArxtkn",82,192,"Commitment! For the year alone 2021, 500 000 #MrocationRenov files have already been deposited. 500,000 effective renovations, serving the ecological transition and purchasing power of our fellow citizens. https://t.co/tdb6cpv8bw https://t.co/qdqvarxtkn ",commitment year alone file already deposit effective renovation serve ecological transition purchasing power fellow citizen,POSITIVE,POSITIVE,POSITIVE
34,1437825495563898885,2021-09-14 17:08:06+00:00,"Démocratie, travail, transition écologique : je propose au Conseil économique, social et environnemental de se saisir de ces 3 questions urgentes et fondamentales. https://t.co/EuqJQFPb0t",50,171,"Democracy, Work, Ecological Transition: I propose to the Economic, Social and Environmental Council to seize these 3 urgent and fundamental issues. https://t.co/euqjqfpb0t ",democracy work ecological transition propose economic social environmental council seize urgent fundamental issue,POSITIVE,POSITIVE,POSITIVE
35,1437413022721576961,2021-09-13 13:49:05+00:00,La preuve par l’exemple : https://t.co/CYBu93eu0C,129,399,The proof by example: https://t.co/cybu93eu0c ,proof example,NEUTRAL,NEUTRAL,NEUTRAL
36,1437400307210854400,2021-09-13 12:58:33+00:00,"La campagne de rappel vaccinal débute aujourd'hui dans les EHPAD avec un objectif simple : mieux protéger nos aînés dont le système immunitaire est moins réactif. À la « Maison Ferrari », à Clamart, 85% des résidents y sont éligibles et pourront y recevoir une injection. https://t.co/0H8sZzjbkt",65,296,"The vaccinal reminder campaign is starting today in the EHPAD with a simple goal: to better protect our elders whose immune system is less responsive. At the ""Ferrari Maison"", in Clamart, 85% of the residents are eligible and will be able to receive an injection. https://t.co/0h8szzjbkt ",vaccinal reminder campaign start today ehpad simple goal well protect elder whose immune system less responsive ferrari maison clamart resident eligible able receive injection,POSITIVE,POSITIVE,POSITIVE
