,id,created_at,text,rt_count,fav_count,english,cleaned_text,zeroshot_sentiment,vader_sentiment,blob_sentiment
769,1304447063590137857,2020-09-11 15:49:50+00:00,"Un élément suscite particulièrement notre inquiétude : pour la première fois depuis de longues semaines, nous avons une augmentation sensible du nombre de personnes hospitalisées suite à une infection par la #COVID19.",237,674,"One element particularly involves our concern: for the first time in many weeks, we have a significant increase in the number of people hospitalized following an infection by # Covid19. ",one element particularly involve concern first time many week significant increase number people hospitalize follow infection,NEGATIVE,POSITIVE,POSITIVE
770,1304446068202012672,2020-09-11 15:45:52+00:00,#COVID19 | L'évolution de la situation épidémiologique fait apparaître une dégradation manifeste de la situation : le virus circule de plus en plus en France. https://t.co/nvhcM3iIxv,113,205,# COVID19 | The evolution of the epidemiological situation reveals a clear degradation of the situation: the virus circulates more and more in France. https://t.co/nvhcm3iixv ,evolution epidemiological situation reveal clear degradation situation virus circulates france,NEGATIVE,NEGATIVE,POSITIVE
771,1304419893492830209,2020-09-11 14:01:52+00:00,#COVID19 | Je m'exprimerai à 17h00 depuis l'hôtel de Matignon.  Déclaration à suivre en direct sur :  ➖ Facebook : https://t.co/ftAE8RdmFb ➖ Twitter : @GouvernementFR. https://t.co/bTQ5WmRAGu,264,548,# COVID19 | I will speak at 17:00 from the Matignon Hotel. Statement to follow live on: ➖ Facebook: https://t.co/ftae8rdmfb ➖ twitter: @Government. https://t.co/btq5wmragu ,speak matignon hotel statement follow live facebook twitter,NEUTRAL,NEUTRAL,POSITIVE
772,1304038793465475072,2020-09-10 12:47:30+00:00,"Mes sincères félicitations et tous mes voeux de réussite à @CCastaner. Nous travaillerons, en confiance, au succès de l'action du Gouvernement, dans le respect de chacun. Je salue @AuroreBerge et l'ensemble des candidats : l'heure est maintenant au rassemblement.",70,386,"My sincere congratulations and all my wishes for success at @ccastan. We will work, confidently, to the success of the government's action, in respect of each. I greet @auroreberge and all candidates: the time is now at the gathering. ",sincere congratulation wish success work confidently success government action respect greet candidate time gathering,POSITIVE,POSITIVE,POSITIVE
773,1303408433992028160,2020-09-08 19:02:41+00:00,"Le pass Navigo n'augmentera pas et les investissements dans le réseau francilien seront maintenus : avec le protocole signé avec @IDFmobilites, l'État préserve le pouvoir d'achat des franciliens et poursuit l'amélioration de leur réseau de transports en commun.",232,762,"The Navigo Pass will not increase and investments in the Francilian network will be maintained: with the protocol signed with @IDFMobilites, the state preserves the purchasing power of the Francilians and continues to improve their public transport network. ",navigo pass not increase investment francilian network maintain protocol sign state preserve purchase power francilian continue improve public transport network,NEGATIVE,POSITIVE,NEUTRAL
774,1303378669801537536,2020-09-08 17:04:25+00:00,"Hommage au brigadier Arnaud Volpe et au maréchal-des-logis S.T., morts pour la France. La Nation tout entière s’incline en votre mémoire : elle n’oubliera jamais votre sacrifice. https://t.co/PLgjD4xIGm",79,384,"Tribute to Brigadier Arnaud Volpe and Marshal-des-Logis S.T., dead for France. The entire nation bows in your brief: she will never forget your sacrifice. https://t.co/plgjd4xigm ",tribute brigadier arnaud volpe marshal des logis dead france entire nation bow brief never forget sacrifice,POSITIVE,NEGATIVE,NEGATIVE
775,1303304533121085445,2020-09-08 12:09:49+00:00,"Cas contact d’une personne testée positive à la COVID-19, je suivrai le protocole élaboré par le Gouvernement et les autorités de Santé. Il s’applique à toutes et tous. J’exercerai la plénitude de mes fonctions en respectant scrupuleusement les recommandations sanitaires.",362,1839,"Case contact of a positive-tested person at COVID-19, I will follow the protocol developed by the government and the health authorities. It applies to all and all. I will exercise the fullness of my duties by scrupulously respecting health recommendations. ",case contact positive test person covid follow protocol develop government health authority apply exercise fullness duty scrupulously respect health recommendation,POSITIVE,POSITIVE,POSITIVE
776,1303015834445590528,2020-09-07 17:02:38+00:00,"Vous êtes étudiant, et vous venez d'effectuer votre rentrée, ou vous retrouverez les amphis dans les prochains jours. Contexte sanitaire, entrée sur le marché du travail : je sais vos inquiétudes légitimes et vos craintes. Le Gouvernement est à vos côtés et va vous aider :",178,710,"You are a student, and you have just made your return, or you will find the amphs in the coming days. Sanitary context, entry into the labor market: I know your legitimate worries and fears. The government is at your side and will help you: ",student make return find amph come day sanitary context entry labor market know legitimate worry fear government side help,NEGATIVE,NEGATIVE,NEUTRAL
777,1302906275647324170,2020-09-07 09:47:17+00:00,"Je l’ai dit à ces nouveaux étudiants de l’@UnivParisSaclay : investir dans l’enseignement supérieur, c’est un choix politique fort mais c’est aussi un pari sur l’avenir. Les choses bougent : leur établissement vient d’entrer dans le TOP20 des meilleures universités mondiales ! https://t.co/b6ZE7J1lnM https://t.co/2WGGwDCQvZ",70,189,"I told these new students from @ univparissaclay: investing in higher education, it is a strong political choice but it is also a bet on the future. Things move: their establishment has just entered the Top20 of the best world universities! https://t.co/b6ze7j1lnm https://t.co/2wggwdcqvz ",tell new student univparissaclay invest high education strong political choice also bet future thing move establishment enter good world university,POSITIVE,POSITIVE,POSITIVE
778,1302902430443745280,2020-09-07 09:32:00+00:00,"Après des mois d’enseignement à distance, 2,6 millions d’étudiants retrouvent aujourd’hui leurs amphis. Une rentrée marquée par le contexte sanitaire mais aussi par l’investissement exceptionnel du Gouvernement dans l’Université et la Recherche - le plus important depuis 1945 ! https://t.co/uL4QlsyG6P",116,366,"After months of distance learning, 2.6 million students today find their amphs. A return to the health context but also by the exceptional investment of the government in the university and research - the most important since 1945! https://t.co/ul4qlsyg6p ",month distance learn million student today find amphs return health context also exceptional investment government university research important since,POSITIVE,POSITIVE,POSITIVE
779,1302297320621514752,2020-09-05 17:27:31+00:00,"Né dans la capitale des Alpes, formé au Chambéry CF, victorieux dans mes chères Pyrénées : @NansPeters rappelle de la plus belle des manières que @LeTour de France est avant tout le tour de la France. Bravo ! #TDF2020 https://t.co/ESzYkiDfTp https://t.co/ik77Na70QC",93,585,"Born in the capital of the Alps, trained in Chambéry CF, victorious in my dear Pyrenees: @nanspeters reminds the most beautiful manner that @letour de france is above all the tour of France. Well done ! # TDF2020 https://t.co/eszykidftp https://t.co/ik77na70qc ",bear capital alp train chamb ry cf victorious dear pyrenee remind beautiful manner de france tour france well do,POSITIVE,POSITIVE,POSITIVE
780,1302279066976948227,2020-09-05 16:14:59+00:00, #TDF2020 https://t.co/puL4A6nnSX,123,1206,# TDF2020 https: // T. Mecca / Paul 4 Athennesex ,mecca paul athennesex,NEUTRAL,NEUTRAL,NEUTRAL
781,1302271569205616640,2020-09-05 15:45:11+00:00,"Grand homme, grand maire : ces mots reviennent chez tous ceux qui ont connu, apprécié ou côtoyé Antoine Rufenacht. Au Havre, bien sûr ! Mais aussi partout où il oeuvra, avec cette liberté et cette élégance qui jalonnèrent toute sa vie. En pensée avec sa famille et ses proches. https://t.co/wM1DoIknXU",61,294,"Great man, great mayor: these words come back to everyone who knew, appreciated or rubbed with Antoine Rufenacht. In Le Havre, of course! But also wherever he worked, with this freedom and elegance that marked all his life. In thought with his family and loved ones. https://t.co/wm1doiknxu ",great man great mayor word come back everyone know appreciate rub antoine rufenacht le havre course also wherever work freedom elegance mark life think family love one,POSITIVE,POSITIVE,POSITIVE
782,1302177149009367040,2020-09-05 09:30:00+00:00,"Oui, nous pouvons et nous devons sortir par le haut de cette crise ! C'est l'objectif de #FranceRelance. À Châlons-en-Champagne, comme partout dans le pays, nous allons aider nos entreprises à embaucher, à investir, à exporter. https://t.co/sjL9W9NQq7",98,303,"Yes, we can and we have to go out from the top of this crisis! This is the goal of #FranceRence. In Chalons-en-Champagne, as everywhere in the country, we will help our businesses hire, invest, export. https://t.co/sjl9w9nqq7 ",yes go top crisis goal chalon en champagne everywhere country help business hire invest export,NEUTRAL,POSITIVE,POSITIVE
783,1301997661579612163,2020-09-04 21:36:47+00:00,"Populaire et solaire, à la ville comme à la scène. Joyeuse et généreuse, avec son public comme ses amis. Ainsi était Annie Cordy. Avec elle disparaît la bande originale d’une vie faite de bonheurs simples, sincères, et communicatifs. Merci madame !",253,1639,"Popular and solar, to the city as in the scene. Cheerful and generous, with his audience like his friends. So was Annie Cordy. With it disappears the original band of a life made of single, sincere, and communicative happiness. Thank you Madam ! ",popular solar city scene cheerful generous audience like friend annie cordy disappear original band life make single sincere communicative happiness thank madam,POSITIVE,POSITIVE,POSITIVE
784,1301878016172273665,2020-09-04 13:41:21+00:00,"J’entends parler de « cadeaux aux grands groupes ». C’est tout à fait inexact. Près de 75% des entreprises qui bénéficieront des baisses d’impôt de production sont des ETI, TPE ou PME, comme Privé SA, à Châlons-en-Champagne. Priorité à l’emploi local, avec #FranceRelance ! https://t.co/Md5QNPGjSj",148,457,"I hear about ""gifts with large groups"". It's quite inaccurate. Nearly 75% of companies that will benefit from production tax cuts are ETI, TPE or SME, as private SA, in Chalons-en-Champagne. Priority to local employment, with #FranceRelance! https://t.co/md5qnpgjsj ",hear gift large group quite inaccurate nearly company benefit production tax cut eti tpe sme private sa chalon en champagne priority local employment,NEGATIVE,POSITIVE,POSITIVE
785,1301843511797526528,2020-09-04 11:24:14+00:00,Cette entreprise familiale spécialisée dans les silos à céréales réalise près de la moitié de son chiffre d’affaires à l’export : #FranceRelance va l’accompagner durant toute la crise. 250 millions d’euros seront investis pour soutenir le rayonnement de notre économie. https://t.co/8JriXj2KhW,81,283,This family business specialized in cereal silos carries out almost half of its turnover to export: #FranceRelance will accompany it throughout the crisis. 250 million euros will be invested to support the influence of our economy. https://t.co/8jrixj2khw ,family business specialized cereal silos carry almost half turnover export accompany throughout crisis million euro invest support influence economy,NEUTRAL,NEGATIVE,NEGATIVE
786,1301575164002553856,2020-09-03 17:37:55+00:00,"Cette entreprise est l'exemple parfait du type de secteur que nous souhaitons soutenir et que nous soutiendrons avec #FranceRelance. En investissant dans la rénovation thermique, nous réduisons notre empreinte carbone et nous développons l'emploi local. C'est concret, ça marche ! https://t.co/nEEGLKBFYN https://t.co/Zm3Rmsl2FC",49,163,"This company is the perfect example of the type of sector we want to support and support with #FranceRence. By investing in thermal renovation, we reduce our carbon footprint and we develop local employment. It's concrete, it works! https://t.co/neeglkbfyn https://t.co/zm3rmsl2fc ",company perfect example type sector want support support invest thermal renovation reduce carbon footprint develop local employment concrete work,POSITIVE,POSITIVE,POSITIVE
787,1301566177504907265,2020-09-03 17:02:13+00:00,"Oui, on peut concilier écologie et économie dans un cercle vertueux. La relance sera verte ! L'exemple vient souvent du terrain : nous étions cet après midi au coeur des Vosges, sur le site de Pavatex, spécialisé dans l'isolation énergétique. #FranceRelance https://t.co/x67puq8n2x",87,275,"Yes, we can reconcile ecology and economy in a virtuous circle. The recovery will be green! The example often comes from the ground: we were this afternoon in the heart of the Vosges, on the Pavatex site, specialized in energy insulation. #FranceRence https://t.co/x67puq8n2x ",yes reconcile ecology economy virtuous circle recovery green example often come ground afternoon heart vosge pavatex site specialize energy insulation,POSITIVE,POSITIVE,NEGATIVE
788,1301513108083675136,2020-09-03 13:31:20+00:00,#FranceRelance : du dessein au dessin. ✏️ @OlivierSampson https://t.co/iyB1uHmoBH,451,911,#FranceRence: From design to drawing. ✏️ @oliviersampson https://t.co/iyb1uhmobh ,design drawing,NEUTRAL,NEUTRAL,NEUTRAL
789,1301500559875342338,2020-09-03 12:41:28+00:00,#FranceRelance renforcera notre cohésion sociale et territoriale. https://t.co/gvvTVw9BaU,40,117,#FranceRence will strengthen our social and territorial cohesion. https://t.co/gvvtvw9bau ,strengthen social territorial cohesion,POSITIVE,POSITIVE,POSITIVE
790,1301495869049647104,2020-09-03 12:22:50+00:00,"Il est économiquement et socialement infiniment préférable de dégrader temporairement les soldes publics pour investir, réarmer l’économie et repartir de l’avant, plutôt que de s’enfoncer dans l’austérité, laisser exploser le chômage, et les drames humains. #FranceRelance https://t.co/NLksGUls9H",128,366,"It is economically and socially best preferable to temporarily degrade public balances to invest, reset the economy and start from the front, rather than sink into austerity, let the unemployment explode, and human dramas. #FranceRence https://t.co/nlksguls9h ",economically socially well preferable temporarily degrade public balance invest reset economy start front rather sink austerity let unemployment explode human drama,POSITIVE,NEGATIVE,POSITIVE
791,1301492006372421632,2020-09-03 12:07:29+00:00,"#FranceRelance est d'abord un plan pour le climat et la biodiversité. Il y consacre 30 milliards d'euros, ce qui revient à doubler, dans les deux prochaines années, la totalité des moyens que l’État consacre habituellement à l’environnement. https://t.co/X8CYf2cD7n",45,130,"#FranceRelance is first a plan for climate and biodiversity. It devotes 30 billion euros, which amounts to doubling, in the next two years, all the means that the state usually devotes to the environment. https://t.co/x8cyf2cd7n ",first plan climate biodiversity devote billion euro amount double next two year mean state usually devote environment,POSITIVE,POSITIVE,NEGATIVE
792,1301490375471890432,2020-09-03 12:01:00+00:00,"Grâce à l’accord historique obtenu par le président de la République avec la chancelière Angela Merkel, nous bénéficierons d’un financement européen de #FranceRelance à hauteur de 40 milliards d'euros, soit 40% des dépenses du plan. https://t.co/Z5t433F7CX",83,291,"Thanks to the historical agreement obtained by the President of the Republic with Chancellor Angela Merkel, we will receive European #FranceRelance funding for 40 billion euros, or 40% of plan expenses. https://t.co/z5t433f7cx ",thank historical agreement obtain president republic chancellor angela merkel receive european funding billion euro plan expense,POSITIVE,POSITIVE,NEUTRAL
793,1301487256553877507,2020-09-03 11:48:37+00:00,"Il n’y aura pas de hausses d’impôts. Nous ne reproduirons pas l’erreur de procéder à des hausses répétées et massives de la fiscalité qui affaibliraient notre croissance et enverraient des signaux négatifs, tant aux ménages qu’aux entreprises.  #FranceRelance",246,906,"There will be no tax increases. We will not reproduce the error of repeating and massive increase in taxation that would weaken our growth and to send negative signals, both households and businesses. #Forseland ",no tax increase not reproduce error repeat massive increase taxation would weaken growth send negative signal household business,NEGATIVE,NEGATIVE,NEGATIVE
794,1301486039027060739,2020-09-03 11:43:46+00:00,"C'est ici, chez X-FAB, à Corbeil-Essonnes, que j'avais souhaité réaliser mon premier déplacement. Les baisses d’impôt de production profiteront d’abord à toutes ces TPE, PME et ETI, qui maillent le territoire et structurent nos bassins d’emploi. #FranceRelance https://t.co/MF4qyZ193g",41,94,"It is here at X-Fab, Corbeil-Essonnes, which I wanted to realize my first trip. The production tax declines will first benefit all these TPEs, SMEs and ETIs, which link the territory and structure our employment basins. #FranceLance https://t.co/mf4qyz193g ",x fab corbeil essonne want realize first trip production tax decline first benefit tpe sme etis link territory structure employment basin,NEUTRAL,POSITIVE,POSITIVE
795,1301484941067399169,2020-09-03 11:39:25+00:00,"Nous accompagnerons tous les ménages vers la transition écologique, que ce soit pour rénover leur logement, changer de véhicule ou se déplacer de façon plus facile et moins polluante aussi bien dans les grandes villes que dans les territoires. #FranceRelance",92,335,"We will accompany all households towards the ecological transition, whether to renovate their housing, change vehicles or move in easiest and less polluting way as well in big cities as in the territories. #Forseland ",accompany household towards ecological transition whether renovate housing change vehicle move easiest less pollute way well big city territory,POSITIVE,POSITIVE,POSITIVE
796,1301483024962510848,2020-09-03 11:31:48+00:00,"Priorité à l'emploi ! #FranceRelance, c'est pour Baptiste, Léa ou Florian, rencontrés à Besançon : avec la prime de 4 000 €, nous soutenons l'emploi des jeunes qui sont aujourd'hui les premières victimes de la crise. https://t.co/rj7DAt44hT",52,149,"Priority to employment! #Forseland, it is for Baptiste, Léa or Florian, met in Besançon: with the premium of € 4,000, we support the use of young people who are today the first victims of the crisis. https://t.co/rj7dat44ht ",priority employment baptiste l florian meet besan premium support use young people today first victim crisis,NEGATIVE,NEGATIVE,POSITIVE
797,1301481965175148546,2020-09-03 11:27:35+00:00,"#FranceRelance, c'est une ambition et une ampleur historique. 100 milliards, c’est quatre fois plus que le plan de relance de 2008. C’est, en proportion de la richesse nationale, le plan de relance le plus massif annoncé à ce jour parmi les grands pays européens. https://t.co/q1JaJoI3rl",186,350,"#Forseland, it's an ambition and historical magnitude. 100 billion, it's four times more than the 2008 stimulus plan. It is, in proportion to national wealth, the most massive stimulus plan announced to date among major European countries. https://t.co/q1jajoi3rl ",ambition historical magnitude billion four time stimulus plan proportion national wealth massive stimulus plan announce date among major european country,POSITIVE,POSITIVE,POSITIVE
798,1301448996611911680,2020-09-03 09:16:35+00:00,"30 milliards pour la transition écologique, c’est historique et c’est inédit !  #FranceRelance https://t.co/CLWaDRsjLZ",93,238,"30 billion for the ecological transition, it's historic and it's unpublished! #FranceRence https://t.co/clwadrsjlz ",billion ecological transition historic unpublished,NEUTRAL,NEUTRAL,POSITIVE
799,1301433720369545216,2020-09-03 08:15:53+00:00,"#FranceRelance sera un puissant accélérateur de la transition écologique. Un exemple très concret : investir dans la rénovation énergétique des bâtiments, c'est mettre un terme aux passoires thermiques, tout en développant l'emploi. https://t.co/qf8VrJb35D",182,643,"#Forseland will be a powerful accelerator of the ecological transition. A very concrete example: investing in the energy renovation of buildings is to put an end to thermal coquals, while developing employment. https://t.co/qf8vrjb35d ",powerful accelerator ecological transition concrete example invest energy renovation building put end thermal coqual develop employment,POSITIVE,POSITIVE,POSITIVE
800,1301416230398709760,2020-09-03 07:06:23+00:00,L'objectif de #FranceRelance est de créer 160 000 emplois en 2021. Ce ne sont pas des rodomontades : nous aurons des indicateurs concrets et des outils de suivi transparents auxquels auront accès Parlement et partenaires sociaux. #RTLmatin https://t.co/wZw8D8AGXk,80,213,"The objective of #FranceRence is to create 160,000 jobs in 2021. These are not roodomontades: we will have concrete indicators and transparent monitoring tools to which Parliament access and social partners will have. #RTLMatin https://t.co/wzw8d8agxk ",objective create job not roodomontade concrete indicator transparent monitoring tool parliament access social partner,NEUTRAL,POSITIVE,POSITIVE
801,1301402996207742978,2020-09-03 06:13:47+00:00,La crise a mis en lumière la dépendance de notre économie dans certains secteurs qui sont vitaux pour le pays. #FranceRelance va investir massivement pour relocaliser ou localiser ces activités sur le territoire. #RTLmatin https://t.co/VJqPAqUGEK,95,279,The crisis highlighted the dependence of our economy in some areas that are vital to the country. #FranceRelance will invest heavily to relocate or locate these activities in the territory. #RTLMatin https://t.co/vjqpqugek ,crisis highlight dependence economy area vital country invest heavily relocate locate activity territory,NEGATIVE,NEGATIVE,NEGATIVE
802,1301397967124000768,2020-09-03 05:53:48+00:00,"Le plan #FranceRelance n'est pas un cadeau fait aux entreprises, c'est un cadeau fait à la France pour lutter contre le chômage. #RTLmatin https://t.co/dL4I6b2MHS",202,540,"The #FranceRelance plan is not a gift to business, it's a gift made to France to fight unemployment. #RTLMatin https://t.co/dl4i6b2mhs ",plan not gift business gift make france fight unemployment,NEUTRAL,NEGATIVE,NEUTRAL
803,1301247733177765890,2020-09-02 19:56:50+00:00,Je vous donne rendez-vous demain dans #RTLmatin où je répondrai à @VenturaAlba puis aux questions des auditeurs de @RTL. https://t.co/clBCQ2oZVz,52,156,I give you an appointment tomorrow in #rtlmatin where I will answer @venturaalba and then to the questions of the auditors of @RTL. https://t.co/clbcq2ozvz ,give appointment tomorrow answer question auditor,NEUTRAL,NEUTRAL,NEUTRAL
804,1301218730488279042,2020-09-02 18:01:35+00:00,"1 000 places supplémentaires seront financées par l'État pour accueillir, accompagner et permettre aux victimes de violences conjugales de se reconstruire. À la maison des femmes de Saint-Denis, j'ai vu le travail admirable qui était mené avec elles et pour elles. https://t.co/SlT8Att9ku https://t.co/7NlBWd1kLp",81,236,"1,000 additional places will be financed by the state to welcome, accompany and allow victims of domestic violence to rebuild. At the house of Saint-Denis women, I saw the admirable work that was led with them and for them. https://t.co/slt8att9ku https://t.co/7nlbwd1klp ",additional place finance state welcome accompany allow victim domestic violence rebuild house saint denis woman see admirable work lead,POSITIVE,POSITIVE,POSITIVE
805,1301176541179674627,2020-09-02 15:13:56+00:00,Mon message aux victimes de violences conjugales : sortez de l'ombre et de la condition indigne qui vous est faite. Vous serez accueillies et nous vous aiderons à vous reconstruire. Les auteurs de ces actes insupportables seront poursuivis sans relâche. https://t.co/Swo5cbVAYF,178,532,My message to victims of domestic violence: get out of the shadows and the unworthy condition that is made to you. You will be welcomed and we will help you rebuild. The authors of these unbearable acts will be pursued tirelessly. https://t.co/swo5cbvayf ,message victim domestic violence get shadow unworthy condition make welcome help rebuild author unbearable act pursue tirelessly,NEGATIVE,NEGATIVE,POSITIVE
806,1301073699064381441,2020-09-02 08:25:17+00:00,Pas question de baisser la garde ! Mais la vie scolaire doit être plus forte que le virus. C'est l'intérêt de nos enfants. C'est l'intérêt de la Nation. https://t.co/LksoOdtntu,120,340,No question of lowering the guard! But school life must be stronger than the virus. It is the interest of our children. It is the interest of the nation. https://t.co/lksoodntu ,no question lower guard school life must strong virus interest child interest nation,NEUTRAL,POSITIVE,POSITIVE
807,1301036342265163782,2020-09-02 05:56:50+00:00,Toujours Charlie.,817,5357,Always Charlie. ,always charlie,POSITIVE,NEUTRAL,NEUTRAL
