,id,created_at,text,rt_count,fav_count,english,cleaned_text,zeroshot_sentiment,vader_sentiment,blob_sentiment
239,1386245796601942017,2021-04-25 09:08:47+00:00,"Tests PCR et antigéniques, procédure d’isolement, contrôles aux frontières : à l’aéroport de Paris-Charles de Gaulle, tout est mis en œuvre pour prendre en charge les passagers en provenance des pays à risque. Un dispositif essentiel dans notre bataille contre le virus. https://t.co/LlKlc2Jgp2",99,458,"PCR and antigenic tests, isolation procedure, border controls: at the Paris-Charles de Gaulle airport, everything is done to support passengers from countries at risk. An essential device in our battle against the virus. https://t.co/llklc2jgp2 ",pcr antigenic test isolation procedure border control paris charles de gaulle airport everything do support passenger country risk essential device battle virus,NEUTRAL,NEGATIVE,NEUTRAL
240,1385890209871679488,2021-04-24 09:35:49+00:00,"En déplacement à Toulouse, je suis venu redire l’indéfectible soutien de la Nation à nos policiers et à l’ensemble de nos forces de sécurité intérieure. Hier c’est la République qui a été touchée. Elle saura toujours s’unir derrière ceux qui veillent chaque jour sur elle. https://t.co/Jx3gpdRUc9",110,629,"On the move to Toulouse, I came to repeat the unwavering of the nation to our police officers and all our internal security forces. Yesterday it was the Republic that was affected. She will always unite behind those who watch each day on her. https://t.co/jx3gdruc9 ",move toulouse come repeat unwavering nation police officer internal security force yesterday republic affect always unite behind watch day,POSITIVE,POSITIVE,NEGATIVE
241,1385639916990763010,2021-04-23 17:01:14+00:00,"À nos héroïnes et héros du quotidien qui portent chaque jour avec fierté l’uniforme de la République au péril de leur vie : les Français savent ce qu’ils vous doivent. En leur nom, je m’incline aujourd’hui devant vous avec une profonde émotion et un immense respect. https://t.co/TtAiKoUPXp",230,1069,"To our heroines and heroes of everyday life with pride every day the uniform of the Republic at the risk of their lives: the French know what they must. In their name, I bow today before you with deep emotion and immense respect. https://t.co/ttaikouxp ",heroines hero everyday life pride every day uniform republic risk live french know must name bow today deep emotion immense respect,POSITIVE,POSITIVE,NEGATIVE
242,1385625378073595907,2021-04-23 16:03:28+00:00,Notre détermination à lutter contre le terrorisme sous toutes ses formes et plus que jamais intacte. https://t.co/WtConHTskx,149,681,Our determination to fight against terrorism in all its forms and more than ever intact. https://t.co/wtconhtskx ,determination fight terrorism form ever intact,NEGATIVE,NEGATIVE,NEUTRAL
243,1385603540178149379,2021-04-23 14:36:41+00:00,"La République vient de perdre l’une de ses héroïnes du quotidien, dans un geste barbare et d’une infinie lâcheté. À ses proches, je veux faire part du soutien de la Nation tout entière. À nos forces de sécurité, je veux dire que je partage leur émotion et leur indignation.",848,3342,"The Republic has just lost one of its heroines of everyday life, in a barbaric gesture and infinite cowardice. To his loved ones, I want to share the support of the whole nation. To our security forces, I mean that I share their emotion and indignation. ",republic lose one heroine everyday life barbaric gesture infinite cowardice love one want share support whole nation security force mean share emotion indignation,NEGATIVE,POSITIVE,POSITIVE
244,1385529134114381825,2021-04-23 09:41:02+00:00,"Du concret : dès le premier novembre, 227 000 agricultrices et agriculteurs toucheront en moyenne 100 € de plus par mois. https://t.co/UgpvDao8cu",125,357,"Concrete: From the first November, 227,000 farmers will affect 100 € more per month. https://t.co/ugpdao8cu ",concrete first november farmer affect per month,NEUTRAL,NEUTRAL,POSITIVE
245,1385513445714497536,2021-04-23 08:38:41+00:00,"Rendez-vous rue de la ferme, au coeur du Puy-de-Dôme, pour parler revalorisation des retraites agricoles. Derrière ces paysages, il y a des femmes et des hommes qui veulent vivre dignement du fruit de leur travail : avec @J_Denormandie, nous leur apportons des réponses concrètes. https://t.co/8urZaTXmNw",44,200,"Rendez-vous Rue de la Ferme, in the heart of Puy-de-Dôme, to talk about revalorization of agricultural retreats. Behind these landscapes, there are women and men who want to live with dignity of the fruit of their work: with @J_denormandie, we bring them concrete answers. https://t.co/8urzatxmnw ",rendez vous rue de la ferme heart puy de talk revalorization agricultural retreat behind landscape woman man want live dignity fruit work bring concrete answer,POSITIVE,POSITIVE,NEGATIVE
246,1385277905756897289,2021-04-22 17:02:44+00:00,"Le 3 mai, nous pourrons lever les contraintes de déplacement en journée et envisager, sous réserve de la situation sanitaire, un nouveau train de réouverture autour de mi-mai qui pourrait commencer par les commerces, certaines activités culturelles et sportives et les terrasses.",265,1086,"On May 3, we will be able to lift the displacement constraints during the day and consider, subject to the health situation, a new reopening train around mid-May that could start with businesses, some cultural and sports activities and terraces. ",may able lift displacement constraint day consider subject health situation new reopen train around mid may could start business cultural sport activity terrace,NEUTRAL,NEUTRAL,POSITIVE
247,1385276224243699717,2021-04-22 16:56:03+00:00,C'est grâce à cette mobilisation exceptionnelle que nous sommes sur le bon chemin pour atteindre notre objectif de 20 millions de personnes ayant reçu une première injection à la mi-mai et 30 millions à la mi-juin. https://t.co/nFmRXEVYDe,65,206,It is thanks to this exceptional mobilization that we are on the right path to achieve our goal of 20 million people who received a first injection in mid-May and 30 million in mid-June. https://t.co/nfmrxevyde ,thank exceptional mobilization right path achieve goal million people receive first injection mid may million mid june,POSITIVE,POSITIVE,POSITIVE
248,1385275388172148736,2021-04-22 16:52:44+00:00,Un adulte sur quatre. https://t.co/HBTiUCfrDf,145,637,One in four adults. https://t.co/hbtiucfrddrd ,one four adult,NEGATIVE,NEUTRAL,POSITIVE
249,1385273835956625411,2021-04-22 16:46:34+00:00,"L’amélioration relative mais réelle de la situation sanitaire et les mesures renforcées de protection aux frontières me permettent aujourd’hui de confirmer la reprise des enseignements scolaires la semaine prochaine, comme l’avait annoncé le président de la République. https://t.co/7h8L4zxzFm",73,187,"The relative but real improvement in the health situation and the enhanced border protection measures allow me today to confirm the recovery of school teaching next week, as announced by the President of the Republic. https://t.co/7h8l4zxzfm ",relative real improvement health situation enhance border protection measure allow today confirm recovery school teaching next week announce president republic,POSITIVE,POSITIVE,POSITIVE
250,1385271713294868480,2021-04-22 16:38:08+00:00,"Nous devons rester d’autant plus vigilants que l’épidémie reprend fortement dans certaines parties du monde. C'est notre devoir de nous en prémunir en maintenant un haut niveau de contrôle sur les déplacements, notamment vers ou en provenance de ces pays.",90,380,"We must remain all the more vigilant as the epidemic resumes strongly in some parts of the world. It is our duty to protect us by maintaining a high level of control over travel, especially towards or from these countries. ",must remain vigilant epidemic resume strongly part world duty protect we maintain high level control travel especially towards country,NEGATIVE,POSITIVE,POSITIVE
251,1385270329694695425,2021-04-22 16:32:38+00:00,"Le pic de la troisième vague semble derrière nous et la baisse de la pression épidémique est engagée. Pour autant, nous devons rester très vigilants. Nous faisons face à une souche – le variant dit britannique – qui est plus contagieuse, et donc plus difficile à combattre. https://t.co/opFeuQspJe",84,266,"The peak of the third wave seems behind us and the decline in epidemic pressure is engaged. However, we must remain very vigilant. We face a strain - the Variant says British - which is more contagious, and therefore more difficult to fight. https://t.co/opfeuqspje ",peak third wave seem behind we decline epidemic pressure engage however must remain vigilant face strain variant say british contagious therefore difficult fight,NEGATIVE,NEGATIVE,NEGATIVE
252,1384516053913542656,2021-04-20 14:35:24+00:00,"« Une nation est jugée à travers ses prisons » : aux mots du président de la République, le Gouvernement a joint des actes et tenu ses engagements pris devant les Français. 7 000 places ont déjà été engagées et nous lançons aujourd'hui la création de 8 000 places supplémentaires. https://t.co/7RnV2etlEZ",60,232,"""A nation is judged through its prisons"": the words of the President of the Republic, the Government has attached acts and held its commitments taken before the French. 7,000 places have already been committed and we are launching the creation of 8,000 additional places today. https://t.co/7rnv2et ",nation judge prison word president republic government attach act hold commitment take french place already commit launch creation additional place today,NEGATIVE,POSITIVE,NEUTRAL
253,1384447282020556800,2021-04-20 10:02:08+00:00,Engagement tenu. https://t.co/Cml76DO6My,155,802,Commitment held. https://t.co/cml76do6my ,commitment hold,NEGATIVE,POSITIVE,NEUTRAL
254,1383457002718851072,2021-04-17 16:27:07+00:00,"Je connais bien les arboriculteurs et les viticulteurs des Pyrénées-Orientales. Je sais avec quelle énergie et quelle force ils cultivent cette terre que j’aime tant. Nous les accompagnerons, nous les aiderons et aucune exploitation ne sera laissée sans solution. https://t.co/4ub2UcvK9T",70,343,"I know the arborists and winemers of the Pyrenees-Orientales. I know with what energy and what strength they cultivate this land that I love so much. We will accompany them, we will help them and no exploitation will be left without solution. https://t.co/4ub2ucvk9t ",know arborist winemer pyrenee orientale know energy strength cultivate land love much accompany help no exploitation leave without solution,POSITIVE,POSITIVE,POSITIVE
255,1383440630999752715,2021-04-17 15:22:04+00:00,"Au plus fort de la crise sanitaire, nous n'avons jamais manqué de produits frais sur nos étals, dans chacun de nos marchés. Car nos agriculteurs étaient là, présents, pour nous. Cette fois, c'est nous qui devons être au rendez-vous de la solidarité. Et nous le serons. https://t.co/tUyAhXfmwW",168,815,"At the height of the health crisis, we have never missed fresh products on our stalls, in each of our markets. Because our farmers were there, present, for us. This time, it is we who must be at the rendezvous of solidarity. And we will be. https://t.co/tyahxfmww ",height health crisis never miss fresh product stall market farmer present we time must rendezvous solidarity,NEUTRAL,NEGATIVE,POSITIVE
256,1383362269929644044,2021-04-17 10:10:41+00:00,"Nous avons besoin d'une agriculture forte, c'est une question de souveraineté. Nous allons aider chaque exploitant à se relever.",154,885,"We need strong agriculture, it's a question of sovereignty. We will help each operator get up. ",need strong agriculture question sovereignty help operator get,NEUTRAL,POSITIVE,POSITIVE
257,1383359347464433673,2021-04-17 09:59:04+00:00,"Ils nous nourrissent, cultivent nos terres et font la fierté de notre pays : l'État se devait d'être au rendez-vous pour soutenir nos agriculteurs et l'ensemble de la filière agricole. La solidarité nationale, en actes ! https://t.co/czrjhEGp3Y",236,739,"They feed us, cultivate our lands and make the pride of our country: the state had to be at the rendezvous to support our farmers and the entire agricultural sector. National solidarity, in acts! https://t.co/czrjhegp3y ",feed we cultivate land make pride country state rendezvous support farmer entire agricultural sector national solidarity act,POSITIVE,POSITIVE,NEUTRAL
258,1383345211166756873,2021-04-17 09:02:54+00:00,"Une journée avec et pour nos agriculteurs en Occitanie. Première étape dans ce vignoble situé à Aumes, à quelques pas de la cave coopérative de Montagnac : ici, la température a atteint jusqu'à -7 degrés au petit matin. Du jamais vu, de mémoire de viticulteur. https://t.co/41jKxiDLAE",75,255,"A day with and for our farmers in Occitania. First step in this vineyard located in Aumes, a few steps from the Cooperative Cellar of Montagnac: here, the temperature reached up to -7 degrees in the morning. Never seen, from winemaker. https://t.co/41jkxidlae ",day farmer occitania first step vineyard locate aume step cooperative cellar montagnac temperature reach degree morning never see winemaker,NEUTRAL,NEUTRAL,POSITIVE
259,1383092180378603530,2021-04-16 16:17:27+00:00,C'est grâce à la task force européenne pilotée par @ThierryBreton que notre pays recevra d'ici 15 jours plus de 7 millions de doses supplémentaires du vaccin BioNTech-Pfizer( +250 millions de doses à l'échelle de l'UE) tout en renforçant nos capacités de production. On accélère ! https://t.co/CmnpuFr9h0,271,981,It is thanks to the Task Force European led by @thierrybreton that our country will receive within 15 days more than 7 million additional doses of the Biontech-Pfizer vaccine (+250 million doses at the EU level). By strengthening our production capacities. We accelerate! https://t.co/cmnpufr9h0 ,thank task force european lead country receive within day million additional dose biontech pfizer vaccine million dose eu level strengthen production capacity accelerate,POSITIVE,POSITIVE,NEUTRAL
260,1383055886386659330,2021-04-16 13:53:13+00:00,"Leurs parents sont en première ligne face au virus : c'est l'honneur et le devoir de la République d'avoir maintenu les activités périscolaires de ces jeunes calvadosiens. L'éducation populaire, c'est l'école de la citoyenneté : merci à ceux qui la font vivre ! https://t.co/FNXxdRmTat",79,277,Their parents are in front of the virus: it is the honor and duty of the Republic for maintaining the extracurricular activities of these young Calvadosians. Popular education is the school of citizenship: thank you to those who make it live! https://t.co/fnxxdmtat ,parent front virus honor duty republic maintain extracurricular activity young calvadosian popular education school citizenship thank make live,POSITIVE,POSITIVE,POSITIVE
261,1383021449087189002,2021-04-16 11:36:23+00:00,"Ici, en Normandie, le CHU de Caen sera un des premiers à en bénéficier : l'État prendra en charge les 2/3 de la construction du futur établissement, tout en augmentant sa participation initiale de 50 millions €. Du concret pour nos soignants et leurs patients. https://t.co/oegX85gv0C https://t.co/qWL8NbI7Pu",56,173,"Here in Normandy, Caen's CHU will be one of the first to benefit: the state will take charge of 2/3 of the construction of the future establishment, while increasing its initial participation of € 50 million. Concrete for our caregivers and their patients. https://t.co/oegx85gv0c https://t.co/qwl8nbi7pu ",normandy caen chu one first benefit state take charge construction future establishment increase initial participation million concrete caregiver patient,POSITIVE,POSITIVE,POSITIVE
262,1383021244061249537,2021-04-16 11:35:34+00:00,"Revalorisation des salaires de nos soignants, ouvertures de postes, investissement dans nos établissements hospitaliers : les sommes déployées dans le cadre du Ségur sont inédites et vont concrètement améliorer le quotidien des personnels de santé. https://t.co/tJTYFB2yJN",136,404,"Revalorization of the salaries of our caregivers, post openings, investment in our hospitals: the sums deployed under the Ségur are unpublished and will concretely improve the daily life of health personnel. https://t.co/tjtyfb2yjn ",revalorization salary caregiver post opening investment hospital sum deploy gur unpublished concretely improve daily life health personnel,NEUTRAL,POSITIVE,POSITIVE
263,1382708994926653447,2021-04-15 14:54:48+00:00,Je veux partager avec vous 3 bonnes nouvelles :,315,1989,I want to share with you 3 good news: ,want share good news,POSITIVE,POSITIVE,POSITIVE
264,1382625575148355584,2021-04-15 09:23:19+00:00,"Tous mes vœux de succès et de réussite à @PBleuse qui veillera dès cet été sur le festival Pablo Casals. Une programmation ambitieuse, audacieuse et enthousiasmante - et l’une des plus belles vues sur le Canigou ! https://t.co/sSqbyo1wDy",36,142,"All my wishes for success and success at @pbler who will watch this summer on the Pablo Casals Festival. Ambitious, bold and exciting programming - and one of the most beautiful views of the Canigou! https://t.co/ssqbyo1wdy ",wish success success watch summer pablo casal festival ambitious bold exciting programming one beautiful view canigou,POSITIVE,POSITIVE,POSITIVE
265,1382054444523782150,2021-04-13 19:33:51+00:00,"En pensée avec nos compatriotes musulmans en ce premier iftar que je sais impacté par les restrictions sanitaires. À chacune et chacun, je veux adresser un message de fraternité et souhaiter un bon ramadan.",251,1678,"In thought with our Muslim compatriots in this first Iftar that I know impacted by health restrictions. At each and everyone, I want to send a message of fraternity and wish a good Ramadan. ",think muslim compatriot first iftar know impact health restriction everyone want send message fraternity wish good ramadan,POSITIVE,POSITIVE,POSITIVE
266,1382008506446966794,2021-04-13 16:31:19+00:00,Nous mettrons en œuvre toutes les dispositions permettant d’assurer la sécurité sanitaire des personnes concourant aux opérations de vote et de tous les électeurs.,70,384,We will implement all the provisions for ensuring the safety of persons contributing to voting operations and all voters. ,implement provision ensure safety person contribute voting operation voter,NEUTRAL,POSITIVE,NEUTRAL
267,1381998171396653062,2021-04-13 15:50:15+00:00,"Les semaines qui nous séparent du scrutin ne seront pas de trop. Pour nous donner le temps utile, nous allons décaler d’une semaine supplémentaire les dates des élections. https://t.co/kWgGAWBruo",167,375,"The weeks that separate us from the poll will not be too much. To give us the useful time, we will shift an extra week the dates of the elections. https://t.co/kwggawbruo ",week separate us poll not much give we useful time shift extra week date election,NEGATIVE,POSITIVE,POSITIVE
268,1381977947066789891,2021-04-13 14:29:53+00:00,"Nous avons décidé de suspendre, jusqu'à nouvel ordre, tous les vols entre le Brésil et la France. https://t.co/QncoIAwfCZ",386,1753,"We decided to suspend, until further notice, all the flights between Brazil and France. https://t.co/qncoiawfcz ",decide suspend notice flight brazil france,NEGATIVE,NEGATIVE,NEUTRAL
269,1380855193189892098,2021-04-10 12:08:27+00:00,"Il faut remonter à 1991 pour recenser un épisode climatique comparable à celui qui a ravagé nos exploitations agricoles. Au-delà de notre indéfectible soutien, le secteur agricole attend une réponse puissante et immédiate de l’État. Il sera au rendez-vous. https://t.co/OQHZYa0cRT",127,511,"We must go back to 1991 to identify a climate episode comparable to the one who has ravaged our farms. Beyond our unwavering support, the agricultural sector expects a powerful and immediate response from the state. He will be at the rendezvous. https://t.co/oqhzya0crt ",must go back identify climate episode comparable one ravage farm beyond unwavere support agricultural sector expect powerful immediate response state rendezvous,NEGATIVE,POSITIVE,POSITIVE
270,1380824342653775874,2021-04-10 10:05:52+00:00,"À Lyon, le centre de vaccination du Palais des Sports de Gerland réalise désormais plus de 14 000 injections par semaine. La mobilisation se poursuit et s'amplifie : merci à tous ceux qui joignent leurs forces sur le terrain. On accélère ! https://t.co/XKCdjduJlS https://t.co/mlJw9nwNwK",65,382,"In Lyon, the GERLAND Sports Palace vaccination center now produces more than 14,000 injections per week. The mobilization continues and amplifies: Thank you to all those who join their strengths on the ground. We accelerate! https://t.co/xkcdjdujls https://t.co/mljw9nwnwk ",lyon gerland sport palace vaccination center produce injection per week mobilization continue amplifie thank join strength ground accelerate,POSITIVE,POSITIVE,NEGATIVE
271,1380468658930061312,2021-04-09 10:32:30+00:00,Du concret. C'est grâce au savoir-faire de l'entreprise Laroche et de ses salariés que ces pièces seront demain sur des avions et hélicoptères civils ou militaires : #FranceRelance va l'aider à moderniser son outil de production tout en réduisant son impact environnemental. https://t.co/YC6Pxzbl5O,75,344,Concrete. It is thanks to the know-how of the company Laroche and its employees that these pieces will be tomorrow on civilian or military aircraft and helicopters: #FranceRelance will help it modernize its production tool while reducing its environmental impact. https://t.co/yc6pxzbl5o ,concrete thank know company laroche employee piece tomorrow civilian military aircraft helicopter help modernize production tool reduce environmental impact,POSITIVE,POSITIVE,POSITIVE
272,1380172637775790086,2021-04-08 14:56:13+00:00,"1 adulte sur 5 est désormais primo-vacciné en France. Cet objectif, nous l'avons atteint avec une semaine d'avance grâce à la mobilisation 7 jours sur 7 de nos professionnels de santé, sapeurs-pompiers, mais aussi des élus aux côtés des agents de l'État et des collectivités. https://t.co/kwxEDOaeEJ",111,409,"1 out of 5 adult is now primo-vaccinated in France. This goal, we have reached it with a week in advance with the 7-day 7-day mobilization of our healthcare professionals, firefighters, but also elected officials alongside state agents and communities. https://t.co/kwxedoaeej ",adult primo vaccinate france goal reach week advance day day mobilization healthcare professional firefighter also elect official alongside state agent community,NEUTRAL,NEUTRAL,POSITIVE
273,1380145222085132288,2021-04-08 13:07:17+00:00,Engagement tenu. https://t.co/a83Q1MkCxW,778,3367,Commitment held. https://t.co/a83q1mkcxw ,commitment hold,NEGATIVE,POSITIVE,NEUTRAL
274,1379510372244262912,2021-04-06 19:04:37+00:00,"De la prise de rendez-vous à la première injection, ils sont mobilisés pour nous protéger. C’est grâce ces femmes et ces hommes que la campagne de vaccination s’amplifie dans chacun de nos départements : du fond du cœur, merci ! https://t.co/nrljK0xw3A",129,617,"From making appointments to the first injection, they are mobilized to protect us. It is thanks to these women and men that the vaccination campaign is growing in each of our departments: from the heart, thank you! https://t.co/nrljk0xw3a ",make appointment first injection mobilize protect we thank woman man vaccination campaign grow department heart thank,POSITIVE,POSITIVE,POSITIVE
275,1379502179678105603,2021-04-06 18:32:04+00:00,"Le centre qui a ouvert ses portes ce matin au @StadeFrance permettra de vacciner près de 10 000 personnes chaque semaine. Partout dans le pays, la vaccination s'accélère : nous devrons atteindre dès cette semaine l'objectif de 10 millions de primo-vaccinés. https://t.co/ttUhdckxeG",102,458,"The center that opened this morning at @Stadefrance will vaccinate nearly 10,000 people every week. Throughout the country, vaccination accelerates: we will have to reach the target of 10 million primo-vaccinated this week. https://t.co/ttuhdckxeg ",center open morning vaccinate nearly people every week throughout country vaccination accelerate reach target million primo vaccinated week,NEUTRAL,NEUTRAL,NEUTRAL
276,1379141860732633090,2021-04-05 18:40:17+00:00,"Un indéfectible soutien et davantage de moyens : c’est ce que la République doit à ceux qui la protègent. Aux policiers de Creil qui ont été la cible d’actes inqualifiables, je suis venu adresser un message simple : force restera à la loi. Notre détermination est totale. https://t.co/gyybhLHLFR",191,821,"An indefectible support and more means: that's what the Republic owes to those who protect it. To the police officers who have been the target of unspeakable acts, I came to send a simple message: force will remain on the law. Our determination is total. https://t.co/gyybhlhlf ",indefectible support mean that s republic owe protect police officer target unspeakable act come send simple message force remain law determination total,POSITIVE,POSITIVE,NEGATIVE
